text,label
affecto participated program development norwegian pension system since,1
combining two producers create strong eubased fertilizer industry capable meeting global competition added,2
said sale actively marketing,1
fiskars world scissors brand tm recently learning magazine teachers choice award classroom,2
finnish automation solutions developer cencorp corporation omx helsinki cncv reported thursday november operating loss eur net sales eur period january september,1
via move company aims annual savings eurm main part expected realized year,2
extension new contract eight engines plant produce mw said,2
glaston also efficiency measures units,1
report profiles companies including many key niche players worldwide black decker corporation fiskars corporation fiskars brands inc husqvarna outdoor products inc ks group ryobi technologies inc scotts miraclegro company van group inc,1
finnish civil aviation administration decided temporarily reopen finnish capital helsinki airport since pm pm monday local time,1
net sales sataflexo group came eur group companies employed total people,1
sale result capital loss eurm solidium obtained tikkurila shares march,0
mr atul chopra chief operating officer president tecnotree elaborated eager see continued success former tecnomen bringing lifetree product mena tecnotree umbrella,1
addition mids always online enable full internet browsing,1
measures taken cause onetime costs final part,1
konecranes oyj kcrv fh fell percent euros biggest fall since june,0
changes take effect january not estimated impact number employees,1
firm services include copying printing cadmodelling digital printing scanning sokopro project bank courier services,1
bg crane strong customer base onroad load handling related installation service businesses,1
popular paper far kesko loyal customer magazine pirkka readers,1
companies aim finalize negotiations sign contracts start october,1
endaugust sampo nordea biggest shareholder stake followed state,1
also development online businesses continue,1
finnish waste management cleaning group lassila tikanoja oyj lt net profit went mln euro mln mln euro mln,0
share entitled one vote,1
profit per share eur eur,2
russia accounted lagardere magazine division revenue eur mn usd mn usa,1
relevant authority approvals make mandatory bid required finnish securities markets act,1
marketing use tikkurila existing infra structure local knowledge russia,1
net profit period million euros,1
finnish raute precision supplies weighing dosing systems plants changing name lahti precision,1
lemminkainen infra oy subsidiary lemminkainen sverige ab perform construction work expected start early completed summer,1
megafon subscriber base increased million users december market share number customers amounted late late according teliasonera estimates,2
already allocated money inventory,1
secondquarter net sales expected par first quarter,1
finnish metal components supplier componenta december applied approval turkish capital markets board launch mandatory offer remaining shares iron aluminium castings producer doktas dokumculuk,1
new product launches finland double,2
new sepa cads replace finnish bank cards,1
divested activities net sales eur million operating profit eur million,1
company listed nordic exchange helsinki,1
number one means creating added value stakeholders everything,1
carriers handset makers spin positive event raise interest higherend phones pricier data plans,2
acquisition considerably increase kemira sales market position russian metal industry coatings market,2
results enable preparation conceptual plant design capital estimates,1
no price given transaction merges two london companies worked together number projects including delivery timetables britain national express east coast rail networks,1
section regional news demand finnair asian traffic measured passenger kilometers august compare last year,2
vaisala oyj press release september vaisala signed contract sell oxygen measurement technology business sick maihak gmbh,2
december alone members lithuanian brewers association sold total million liters beer increase percent sales million liters december,2
finland metal sector company componenta laying temporarily staff pori mill christmas till january,0
company specialises temporary electrification heating construction sites,1
neste oil corp signed longterm procurement contracts honkajoki oy findest protein oy owned finnish food manufacturers supply animal fat biodiesel production neste bcd porvoo finland refinery,2
first stage contract covers stores cash registers,1
robust growth result inclusion clothing chain lindex group december,2
niklas skogster employed abb group various positions concerning development operations,1
agreement tietoenator provide blyk extended application business process management services infrastructure,2
decision reflects underutilisation line produces nonwovens used medical wipes applications well automotive industry,1
second quarter company net profit eur compared net loss eur apriljune,2
airvana umts home base station femto cell uses softwarebased functionality offtheshelf silicon accelerate feature development reduce product cost,2
finnish meat company atria no longer promise sufficient amount domestic beef customers,0
jarmo honkamaa head oil refining business neste oil says situation looks promising viewpoint,2
sales per cent finland per cent abroad sales lifted strong growth sales russia lithuania,1
metso oyj said sold spreader roll manufacturing business related assets town nokia southern finland group finnish investors operate business name finbow oy,1
group business sectors building construction infrastructure construction technical building services building products,1
finnish metal products company componenta oyj net profit went slightly mln euro mln first half mln euro mln period,0
raisio bid buy glisten winwin deal companies chairman uk snacks firm told justfood today february,2
capital expenditure energy efficiency unfortunately fallen along decline economy,0
financial statements release available publishing company internet pages wwwcargoteccom,1
seventythree also extensive training products built latest archestra technologies wonderware system platform,1
tonnes asphalt mix used contract,1
adpnews oct finlandbased consultancy tieto oyj hel tiev said today net profit plunged eur million usd first nine months eur million period,0
state program worked legal provisions developed rules normative documents specified functioning technological park,1
lemminkinen started manufacture roofing felt production asphalt,1
superior customer centricity expertise digital services set us apart competitors,2
operating profit quarter apriljune amounted eur sales eur bn,1
oriolakd expects invoicing higher comparable invoicing,2
turn fradkov said russia interested adopting finnish experience forming technology parks framework implementing law special economic zone,1
estonia beer market overall grew three percent last year million liters,2
upmkymmene wwwupmkymmenecom produces magazine papers newsprint well fine specialty papers converting materials wood products,1
group revenue amounted eur million company currently employs approximately people,1
protalix developing genetically engineered proteins plant cells,1
via agreement ramirent expand range equipment services delivers destia ramirent finland managing director kari aulasmaa said,2
thanksto improvements demand adjustments made theutilization rates cramo fleet substantiallyimproved,2
order also includes startup commissioning services,1
order consists capacity expansion maintenance services new charging functionality company said,1
partnership finnish paulig danish subsidiary oscar puljonki acquired sales organization european market,1
company reported profit euro mlnon sale varesvuo partners subgroup loss euro caused sale program production subsidiary oy filmiteollisuus fine ab,1
company expects net sales mln euro mln,1
notice entirety proposals nomination committee board published least four weeks april company website post och inrikes tidningar dagens industri,1
swedish player became majority owner ucell mid,1
ship cranes manufactured macgregor partner plants china delivered vessels ordered chinese cosco german peter dohle hong kong based cido shipping,1
chargers manufactured new platform suitable mobile phones navigators digital cameras bluetooth head sets media players electronic devices,1
nokia calling innovators africa competition specifically launched enable developers create locally relevant bestofbreed mobile applications,2
new factory working model reorganisations would decrease nokian tyres costs factory eur million usd,2
mall financed parity basis pearl plaza llc joint venture company established chinese investor shanghai industrial investment holdings co ltd srv group,1
company board directors propose dividend eur per share annual general meeting scheduled held march,1
stora enso thirdquarter pretax profit doubled eur mn,2
profit period totalled eur mn eur mn third quarter,0
operating profit rose eur mn eur mn corresponding period,2
terms not disclosed,1
parallel teliasonera decided conduct compulsory acquisition,1
company targets sales ls mn ls mn profit ls ls,1
share sale foreign finnish investors expected raise euro million us million,1
company designs manufactures markets advanced composite products industrial applications consumer goods crosscountry alpine nordic walking poles floorball sticks antenna radomes,1
according announcement helsinki stock exchange share sentera shall delisted nmlist helsinki stock exchange accordingly,1
operating profit improved eur mn eur mn,2
size cider bottle remain unchanged,1
addition russia seek additional growth ukraine,2
london marketwatch share prices ended lower london monday rebound bank stocks failed offset broader weakness ftse,0
elcoteq dongguan established nancheng district dongguan china one elcoteq four volume manufacturing plants asiapacific region,1
sales tiimari business went eur million gallerix stores saw growth eur million,0
part new strategy finnish biohit planning incorporate diagnostics business separate limited company,1
satama net sales would higher year,2
mr doring eaton since acted business unit manager eaton power controls business unit since january,1
board directors proposes shareholders meeting march company would pay dividend financial year january december eur per share,1
net cash operating activities negative eur mn compared eur mn,0
price kesko share mln euro mln recognize gain mln euro mln disposal included result second quarter,2
meego learns use fisher said putting important things top,1
pretax loss totaled eur mn profit eur mn,0
report goes provide detailed profiles ten leading european specialty chemicals companies brief profiles major players,1
grapevine city officials september approved million tax rebates grants expansion,2
operating profit month period decreased eur net turnover increased eur compared financial year,0
planning expand product portfolio harbor segment chief executive pekka lundmark told financial times deutschland,2
thus group balance sheet eur million goodwill company added,1
ruukki order book end yearonyear quarteronquarter,2
rosen cautious optimistic inregard second half year,1
adp news oct finnish lifting equipment maker konecranes oyj omx kcrv said today net profit rose eur million usd first nine months eur million,2
adpnews dec finnish investment group neomarkka oyj hel nembv said today furlough employee unit reka cables ltd less days starting january,1
ebrd using funds provide million loan b portion million euros syndicated two finnish commercial banks nordea bank finland plc pohjola bank plc,1
mill raw material need increase wood,1
new facility known technopolis pulkovo introduce russian market entirely new concept creating operating growing commerciallyfunded science technology park support growth knowledgeintensive companies,1
delhaize le lion selected aldata gold vocal pda solution motorola wt pda terminal,1
company still expects turnover slightly increase level adding market predictability still poor trustworthy forecasts market development contract manufacturing business current year,2
global banking news september tieto corporation pohjola bank pink pojlf cooperate swift services,2
capman plc press release march jukka ruuska president omx nordic exchanges stockholm stock exchange transfer capman effective no later september,1
kemira partner project st petersburg water works,1
total value two contracts eur million,1
okmetic revised financial outlook based order book,1
also potential clients growing environmental recycling technology sectors,1
telecomworldwire april tj group plc sells stake morning digital design oy finnish company tj group plc said friday april signed agreement selling shares morning digital design oy edita oyj,1
bring cost savings eur mn year,2
podcast sees harple provide lowdown gypsii platform takes someone location demographic information produce contextual index world around,1
cash flow operating activities investments eur million eur million,1
according saarioinen managing director ilkka mkel food industry sector significant excess production machinery,1
value contract eur mn,1
finnish pulp paper machinery maker vaahto group oyj swung mln euro mln net profit fiscal ended august euro net loss fiscal,2
grounds notification tiimari plc issued capital convertible loan allocation decision board,1
net sales financial year expected amount eurm operating result ebit expected loss announced,0
lcs services cover whole life cycle software information systems process modelling tailored software development hosting services solution management maintenance support,1
main strength cooperation project lies merging knowhow two large companies,2
pretax profit totalled eur mn compared loss eur mn corresponding period,2
deliveries start later volume increase years,1
finnish company stockmann signed contract company technopolis,1
first half bank operating profit fell eur mn eur mn net interest income increased eur mn eur mn first half,0
order related renewing network telecommunications operator,1
finnish swedish construction markets still experiencing estimated annual growth,2
making matters difficult company said grappling higher oil gas prices pushed cost energy raw materials transportation,0
negotiations carried constructive manner parties tried find solution situation,2
basware connectivity services companies gain visibility audit trail traced order goods delivery invoice,1
company transportation business conducted florida rock tank lines southeastern transportation company concentrating hauling motor carrier liquid dry bulk commodities,1
parties agreed not disclose price deal group said press release,1
stora enso global paper packaging wood products company neste oil finnish company engaged refining marketing oil inaugurated demonstration plant varkaus finland biomass liquids production utilizing forestry residues,1
sampo bank market share lending first quarter,0
remote phone management demonstrates sysopen digia unique endtoend offering operators handset manufacturers enterprise customers,1
group cumulative sales review period eur million eur million profit taxes eur million,1
core solidium investment strategy proper value enhancing asset management current holdings,2
alexandria va march patrik flykt timo alakoski helsinki finland tapio suihko nadarajah asokan espoo finland developed method mobility support internettype protocol traffic communication system,1
pretax profit totaled eur mn eur mn,0
three year turnaround program expected ensure salomon future competitiveness company said,2
no room modify share component already indicated,1
suominen corporation estimates costcutting program started autumn higher sales prices expected growth volume wet wipes make company operations profitable,2
turnover surged eur eur due increasing service demand especially third quarter overall growth business,2
elcoteq se listed nasdaq omx helsinki ltd,1
report examines medical equipment business structure operations history products provides analysis key medical equipment revenue lines,1
jacobs supporting storengy investment developing storage sites since owner engineer,1
provides summary medical equipment pipeline products company developing,1
registration required,1
europe paper industry situation paradoxical,1
operating profit sales threemonth period increased respectively eur eur compared corresponding period,2
business line may sriperumbudur may nokia two key suppliers aspocomp wintek likely start operations within three months nokia telecom park sriperumbudur km west chennai,1
finnish electronics contract manufacturer scanfil reports net sales eur mn second quarter eur mn year earlier,0
proline plus available adjustable single multichannel models fixed volume singlechannel models volume ranges micro litres ml,1
antniemi refuted report finnish daily turun sanomat company reorganizing operations baltic countries,1
brazilian nonprofit interbank camara interbancaria de pagamentos cip acquired solutions us business integration solutions provider sterling commerce latter company said statement,2
galeria podlaska shopping mall wysockiego street bia ystok approximately percent leased reserved,1
company goal achieve annual savings eur million usd two thirds realized,2
ulefos group leading supplier manhole covers nordic countries,1
operating loss amounted eur mn compared profit eur mn second quarter,0
separating side businesses able faster expand develop tapro retail network,2
order intake hand expected stronger,2
financial statements include consolidated financial statements group board directors report auditors report corporate governance statement,1
typically transmission power level decreased interference noise predefined value,1
significant capital expenditure items global enterprise resource planning erp project product development production machines,1
dnb nord norway likely nordic buyer citadele nordea would good strategic fit according document published pietiek,1
company generates net sales mln euro mln annually employs,1
incap corporation stock exchange announcement april pm invitation news conference incap interim report q incap publish interim report januarymarch wednesday may,1
output contracts totals mwe,1
last smartphone running maemo replaced meego joint project nokia intel open source community,1
solution demonstrated tablet developed aava mobile multiwindow system enables use several applications simultaneously example viewing messages calendar side side,1
announced restructuring significantly decrease company indebtedness,2
estimated turnover new company lvl million eek million,1
addition fireplace exports demand lining stone exceeded level earlier part year continue clearly brisker remainder year,2
finnish electronics contract manufacturer scanfil net sales eur mn first quarter eur mn year,0
based helsinki finland ramirent branches nordic central eastern european countries,1
compared ftse index rose points day relative price change,0
ruukki announced signed agreement aker solutions norway supply suction anchors september kalajoki unit finland,2
ssh communications security corp stock exchange release october pm company updates full year outlook estimates results remain loss full year,0
jensen njastein mike critch head dovre north america business unit report toivola,1
according ceo nordea bank estonia vahur kraft nordea finland stockmann cooperating ten years,2
operator one operators granted wimax license taiwan hopes first launch commercial services early,1
first two project phases expected completed end,1
metso provide recovery boiler capacity tonnes dry solids per day evaporation plant six thermal stages capacity tonnes per hour,1
participants book discussions special events visitors car dealership eligible enter drawing silver fourdoor altima,1
loyal customers found bank land index,2
aug gawker media delivered newstex love fishing video games felt nt enough wackiness involved activision nasdaq atvi rapala fish might catch eye familyfun hook,1
eur h august finnish media group ilkkayhtyma oyj hel ilks said today net profit fell year eur first half,0
lemminkainen oyj said signed credit agreements nordea bank sto nda pohjola bank hel pohs sampo bank hel samas svenska handelsbanken sto shb,1
fund fair value increase correspondingly,2
sony ericsson nokia dominated list bestselling handsets five models,2
besides no depositor preference finland senior debt deposits rank par also taken consideration agency added,1
finnish stainless steel manufacturer outokumpu degefors planning recruit new engineers order meet retirement wave next years,1
alliance aims tap pocketable mobile computers netbooks tablets mediaphones connected tvs invehicle infotainment systems,1
apartments yit home may purchased regions russia yit subsidiaries carry activities moscow moscow region st petersburg ekaterinburg kazan rostovondon,1
prices delivery volumes broadband products decreased significantly,0
incap contract manufacturing services private limited inked agreements six new customers india,2
financial impact estimated annual improvement eur division results fiscal year,2
expanded agreement covers sale marketing distribution benefon navigation locator devices china,1
sales price not disclosed,1
mentioned shareholders suggest monthly salary eur would paid board members outside company,1
reporting period biotie north american licensing partner somaxon pharmaceuticals announced positive results nalmefene pilot phase clinical trial smoking cessation,2
bovine slaughtering cutting kuopio facility transferred kauhajoki slaughterhouse,1
finnish pharmaceuticals company orion reports profit taxes eur mn third quarter eur mn corresponding period,2
construction work helsinki music centre start autumn total cost project estimated million euros,1
january finnish metal products company componenta oyj hel cthv said yesterday net loss narrowed eur last quarter eur period year earlier,2
two companies sat sewed present deal,1
may finnish electronics producer elcoteq se hel elqav said today signed extensive cooperation agreement industrialisation manufacturing distribution aftermarket services mobile phones japan sharp tyo,2
contract covers turnkey deliveries five airports operated authority john f kennedy laguardia newark teterboro stewart international,1
finnish business delegation includes representatives companies include nokia corp finnfund outokumpu oyj oko bank alteams oy cargotec corp,1
flagship open fall manhattan flatiron district toy building fifth avenue,1
bank vtb provides mortgage loans buy apartments complex per annum rubles,1
close omx helsinki pct lower points omx helsinki pct points bln eur turnover,0
rimvesta controlled estonianowned real estate development company ell nekilnojamas turtas member merko largest construction group baltic countries,1
people enjoy mobile games often customers enjoy experimenting new mobile services content,1
xerox stora enso teamed tailor igen shortrun ondemand packaging market,2
ixonos estimates hire specialists mechanical engineering electronics design rd new unit jyvaeskylae end,2
terms power generation fortum produced twh electricity first nine months compared twh period according figures released group latest financial results,1
addition good biological durability achieved,1
hearst able consolidate russian market advertising press purchase,2
peer peugeot fell pct sales rose pct period last year,0
would invest not physical infrastructure would also provide knowhow managing developing science technology parks said sunrise valley director andrius bagdonas,2
mr jortikka president base metal division outotec oyj finland executive committee outotec,1
even little bit higher yara multiples analyst helsinki said,1
recruitment related relocation stora enso research operations karlstad central sweden,1
net sales power plants business eur million,1
private equity investor capman owner finnish lumene cosmetics company planning list lumene,1
company net sales acquired finland european countries asia us,1
timo penttila appointed new manager responsible asset management nordea institutional customers finland,1
necessary strengthen company operations however,1
complying european water framework directive requirements pretreatment unit fully renovated including hydraulics waste water inception degridding sand grease removal treatment deodorization unit,2
officials not disclose contract value,1
latest date registration april,1
net interest income eur mn eur mn,2
result negotiations company terminate total employment contracts,0
orders part longterm development plan latvijas finieris,1
hope clarify policies finnish businesses gray areas motlanthe said,1
fortum needs clear signal commitment government permit available company start next round kuula says,1
total value contract eur mn,1
operating profit net sales month period increased respectively eur eur compared,2
outsourcing agreement covers equipment depots turku tampere run five years cramo said thursday,1
finnair able operate leisure flights despite strike,2
businesses divested offer dairy edible fats readymeal icecream packaging multinational local customers,1
layoffs start gradually last one six weeks,1
n group pay eur transaction price upon closing remaining sum,1
vaisala present weather detector measures visibility km well precipitation type intensity,1
rihko started manage raisio benecol business summer heading tobacco company altadis european operations,1
one colleagues summed e quite aptly remarked fantastic hardware,2
according chairman michael hornborg organizations merely criticised raisio weak performance,1
stonegate product family designed provide full benefits unified management system including shared logging reporting auditing,1
