text,label
operating profit net sales ninemonth period increased respectively compared corresponding period,2
result also burdened increased fixed costs associated operations china restructuring costs japan,0
value orders eur mn,1
apartment block welllocated easy reach city center close school kindergarten,2
strategic operational business information objectively reported,1
fiskars yearold global business best known orangehandled scissors expects derive synergies eur million year consolidating certain parts housewares division two compete,2
profit period eur mn eur mn,2
sales growth cars considerably influence tires market,1
motorola accounted percent south korean handset market end april samsung held percent lg electronics percent according koreabased atlas research group,1
court decision also promote genuine competition services,1
previously announced geosentric oyj entered financing agreements lead investor june enabling company receive financing aggregate amount,1
extensive cooperation also bolster sysopen digia position domestic operator market kallioranta adds,2
company said shareholders able vote agreement egm scheduled later month,1
finland hobby hall sales decreased international sales fell,0
ongoing project tekla structures used vashi exhibition centre developed insteel engineers pvt ltdiivrcl infrastructures projects ltd cidco,1
production scheduled start end april,1
staff reduction start immediately glaston added,0
operating profit fell eur mn eur mn second quarter,0
koduextra operating retail chain stores controlled finnish nonfood center ky rukax oy scantukka oy,1
revenue quarter totaled billion percent billion fourth quarter,0
company decided end temporarily shut ammonia plant billingham extend maintenance period ince facility,0
second variant offers complete final finishing selected apartment foreign high quality materials finland denmark germany france,1
concept enables commercially affordable way manufacture highquality tco coated glass solar industry,2
bold spinning red fabric design set beautifully ercols napoli sofa,2
sold one half business operations enter helsinki stock exchange via back door innovative buyout arrangement kasola,1
strike finnair estimates incur net loss eurm eur per day,0
terms agreement lextel group committed opening order eur benefon mobile units cobranded capitel china market,1
aktia forecasts finland inflation,1
subscriptions increase cargotec share capital euros,2
facility used refinance citycon existing credit facility company said,1
talentum disclose three interim reports q january march friday april q april june friday july q july september friday october,1
earnings per share quarter came eur eur quarter year earlier,2
fine print,1
avc systemhaus net sales eur million usd,1
agreement must approved russian competition authorities enters force,1
earlier today geberit finnish rival uponor oyj cut fullyear sales growth forecast pct pct blaming tough conditions germany us well currency factors,0
net sales went yearonyear eur million affected business acquisitions realized previous financial period effect eur million review period,2
destia oy finnish infrastructure construction service company building maintaining designing traffic routes industrial traffic environments also complete living environments,1
measures expected produce annual cost savings eur million starting,2
pulp production finnish kemijrvi also liquidated employees loose jobs,0
services firm tietoenator bucking general trend holding flat eur slipping back earlier gains,0
kai tulonen chief technology officer sysopen digia says using corporate phonebook inside sysopen digia extensively since last fall satisfied results,2
increased trust clients yit seen apartment sales accelerated,2
expansion includes doubling floor space addition lifting capacity production equipment,2
talks concerned people finland initial estimate redundancies fiskars said,1
transaction planned financed eurm marketbased loan granted standard chartered bank hong kong,1
huhtamaki oyj stock exchange release huhtamaki capital markets day institutional investors analysts held espoo september starting pm finnish time,1
company admits months relatively short time operating russia,1
vessels largest fastest ropax vessels world built fincantieri,1
net sales period expected fall well last year result nonrecurring items expected red,0
according finnish petrol station chain st managing director kim wiio company forced make purchases rising prices first half consumer prices going almost daily due competition,0
nordea bank sto nda sampo bank helped finnish real estate investment company sponda hel sdav place eurm usd domestic bond company said friday,2
nordea bank large share vast experience nordic credit card market,1
rebuilds designed improve machines performance product quality,2
transaction positive impact around eurm earnings ruukki recognize fourth quarter year,2
finnish retail software developer aldata solution oyj reported net loss mln euro mln versus net profit mln euro mln,0
finnish bank land reports operating profit fell eur mn third quarter eur mn third quarter,0
kesko offers hilton open hotel kalinisky prospect square metres building difficulties,1
ea reng group posted sales approximately million kroons,1
company issue inaugural eurobond deal near future subject market conditions,1
furthermore company sell warehouse office buildings loudeac saint marcel lease new joint premises operations morvillars,1
product frontedge folding maximizes weather resilience enables seamless roof finish,1
mr kari stadigh carry chairman board mr matti arteva vicechairman,1
odd square metre plot stockmann bought nevsky center shopping center located nevsky prospect st petersburg high street next vosstaniya square underground station immediate vicinity moscow station,1
agreement biohit becomes focus supplier pipettors disposable pipettor tips vwr customers throughout europe,2
nokia controls percent phone sales india africa strong prosition emerging markets,2
total million invested project,1
lifetree founded revenues risen average margins late,2
financial details transaction not disclosed,1
also latvia act partner bakery customers production product development,1
considerably weaker us dollar british pound impact sales average prices euros upm said,0
special events three counties four months hosted library system nine branch libraries,1
proha plc euronext announced today may fullyowned subsidiary safran software solutions agreed sell share safran north america llc sna holding investment group based norway,1
acquired plant annual capacity tonnes production sold domestic customers,1
buy recommendation reiterated,2
profitability ebit compared q,0
net sales paper segment decreased eur mn second quarter eur mn second quarter operating profit excluding nonrecurring items rose eur mn eur mn,0
finnair total traffic decreased terms revenue passenger kilometres,0
issuer solely responsible content announcement,1
return investment roi compared first half,0
cargotec brands hiab kalmar macgregor global market leaders fields solutions used land sea wherever cargo move,1
stora enso record capital gain eur million nonrecurring financial item fourth quarter results,1
product range includes marinated olives cold cuts pates example,1
cash flow operations januarydecember negative eur mn compared eur mn corresponding period,0
transaction expected finalized dec,1
negotiations concern plant department producing winded roving employs people,1
corresponding increase share capital due subscriptions warrants total eur registered finnish trade register january,1
sponda record profit sale mln euro mln,2
pleased invite join mreal international conference call pm eet,1
nokia siemens networks struggled make profit past two years,0
samsung currently occupies third place lost ground quarter dropping share overall,0
china unicom nyse chu hkse shse second largest mobile carrier country,1
jon risfelt previously held operational executive positions europolitan ericsson sas american express card travel divisions well nyman schultz ceo vodafone sweden ceo gambro renal products ceo,1
middle east north africa tecnotree grown considerably recent years,2
glaston glass processing unit tamglass glass processing manufacturer high quality safety glass products operating finland,1
unaudited consolidated results aspocomp group ifrs reporting standards,1
move aimed boosting sales costefficiency market share finland,2
von koskull oversee new unit nordea brings together corporate merchant banking financial institutions capital markets products divisions,1
capman six investment areas capman buyout capman technology capman life science capman russia capman public market capman real estate dedicated team funds,1
maximum amount terminations finland employees company added,1
consisting seven interconnected units mega image logistics center metres length metres height,1
estonian telecoms company elisa customer numbers cross tallinn oct bns estonian telecommunications company elisa approximately new clients nine months year bringing number end september company said,2
ge building facility wind power developer invenergy wind llc,1
goal significant expansion finland northern baltic region,1
earnings per share eps amounted eur loss eur,2
danske bank danske dc jumped percent kroner rebounding yesterday percent slide,2
augustoctober company result taxes totalled eur mn eur mn corresponding period,2
result company currently anticipates net sales increase operating result positive,2
nordea definitely big sampo acquire said analyst sampo would appear agenda nordea ahead privatisation,1
second phase new innova building tecnopolis presence jyvaskyla increase total approximately floor square meters,1
october finnish environmental management company lassila tikanoja oyj hel latv lt said today net profit declined eur first nine months eur period year earlier,0
transaction alma media raised stake talentum shares voting rights,2
filippova trilateral agreement investment construction technology park st petersburg signed course forum days russian economy opened helsinki today,2
finland sampo bank part danske bank group lay staff administrative support functions,0
stockmann mastercard widened scope cooperation estonia latvia,2
exel composites brief exel composites technology company designs manufactures markets composite profiles tubes industrial applications,1
vaisala also said expects net sales eur million compared eur million recorded,2
comparable net sales expected increase line group target,2
cargotec also move hallbergivarsson service installation business roof service center kalmar macgregor solutions gothenburg,1
recovery demand started toward end continued januarymarch,2
czech republic profiling unit ostrava closed machinery relocated ruukki bigger plants hungary poland romania end first quarter,1
first oil company join rspo commits fully sustainable sourcing feedstocks production nexbtl biodiesel said,1
cargotec share capital increase totals eur,1
initially company said maximum people would made redundant parent company subsidiaries,0
total surveillance cameras handled managed according variety needs company said,1
financialwire tm cooperation investrend broadcast syndicate also provides complete daily conference call webcast schedules service shareholders investors via firstalert tm networks oefirstalert tm daily,1
ruukki signed contract deliver install steel structures bridge kyronsalmi strait savonlinna finland,2
sale result gain eur million second quarter oriolakd supports finnish company strategy focus pharmaceutical wholesale retail operations,2
cargotec sales totalled eur billion employs approximately people,1
iggesunds bruk sweden one advanced fully integrated pulp paperboard mills world,2
according ceo hannu syrjnen new common name visual identity required group grown internationalised,1
following increase huhtamaki registered share capital eur number shares outstanding,1
transaction expected completed next spring,1
lays foundation sustainable business development long term,1
latest result included pershare charges cents stock compensation cent research development cent strategic investments,1
idea saving electricity data transfer still new one,1
theodosopoulos said tellabs could value nokia siemens nortel given leading supply status verizon along highgrowth products,2
profit taxes eur million,1
mreal corporation press release november mreal corporation second best company materials sector including eg forest industry companies carbon disclosure leadership index cdli nordic report,2
teleste hybrid tv solution includes components whole process delivering video services consumers content acquisition service creation delivery range access solutions including hfc hybrid fibrecoaxial xdsl etth ftth,1
poyry contract includes engineering management civil detail engineering services time scheduling procurement services,1
cramo slipped pretax loss eur million pretax profit eur million,0
outokumpu declined pct eur omx helsinki pct higher omx helsinki added pct,1
finnish plastic pipe maker uponor selling irish uk infrastructure businesses private equity company,1
building owner developer sun hung kai properties group one largest property companies hong kong developing types premium residential commercial projects sale investment,1
januaryaugust imports sea container lorry trailer units fell exports corresponding period,0
componenta production lines similarsized products karkkila finland weert netherlands orhangazi turkey combined output approximately tonnes net sales eur million,1
production capacity increase tonnes per year raw material continue recycled paper board,2
neste oil working research communities europe america africa asia australia develop introduce new raw materials,2
fortum also blocking stake northwestern tgk,1
guangdong october sinocast nokia telecommunications dongguan branch entered letter intent open nokia class qingyuan polytechnic qingyuan city guangdong province,1
vdw combined lxe devices enhances productivity enabling workers use single device perform voice scanning keyboard functions,2
global life science industry strictly regulated international national authorities,1
part development worldclass magnetite deposit karara known potential million metric tons annual processing magnetite estimated year life,1
addition presentations held president ceo kai telanne cfo tuomas itkonen participants opportunity discuss members company management,1
new company buy baltic pearl cjsc lease right hectares construction mall gross area sq million sq ft,1
finnish government announced wednesday sold percent stake chemicals fertilizer group kemira oyj xac million us million sending company share price percent,2
handpainted resin real trebles cm long cm deep top bottom middle hook,1
favourable currency rates also contributed higher net sales ceo kari kauniskangas said,2
finnish suominen corporation specialises wet wipes nonwovens flexible packaging reports net sales eur mn second quarter eur mn second quarter,2
also westpac issue benchmark month frn deal euros,1
first quarter marktomarket result pretax profit eur million versus loss eur million period last year,2
employeremployee talks concerned people whole staff finland,1
part reorganisation measures take place spring tamglass finton start personnel negotiations affect entire staff,0
need malware removal tools type url vendor choice directly browser bar use links website wrote trend micro rik ferguson monday,1
finland nokian tyres kazakhstan ordabasy corporation signed agreement build plant astana produce car tires ordabasy chairman dinmukhamet idrisov said press conference,2
passenger ferry dimensions length overall length perpendiculars breadth design draught,1
los angelesbased pacific office properties trust acquires owns operates office properties western us focusing initially markets honolulu san diego los angeles phoenix,1
thanks extensive industry operations experience cybercom offers strategic technological expertise markets telecom industry media public sector retail banking financial services,1
acquisition landsbanken sverige burdened performance eur mn,0
stx finland oy signed preliminary agreement building environmentally friendly new generation cruise ferry viking line manage turku finland stockholm sweden withviking line abp,2
march stora enso refused comment news way,1
previously company also delivered steel used oasis seas allure seas sister ship completed last year,1
one headboxes equipped modern consistency control system ensure cross machine profile plasterboard company said statement received lesprom network,1
revenue quarter fell percent euro billion compared year earlier,0
business idea budget sport offer customers wide range highquality sports equipment clothing low prices company said,1
total investment company eurm wartsila share eurm,1
cents recognize potential partnerships suppliers,1
eurochem head corporate finance alexander gavrilov said pleased confirmed eurochem able attract longterm funds attractive rates,2
company us subsidiary vaisala inc acquires aviation systems maintenance inc asmi kansas us based airport service company million usd net sales,1
value contracts eur mn,1
basware finances acquisition bank loan,1
flurry analytics spokesperson said measuring windows phone data weeks firm doublechecked data make sure per cent rise not aberration,1
currently plant operates full capacity,1
cost deal could range million million euros depending financial results two companies statement says,1
yit capital markets day materials available company internet site wwwyitgroupcominvestors september,1
combine renew contents functionality current systems funding online service well maintenance,2
energy shot packed millilitre bag screw cap,1
according gallup food farm facts beef consumption totaled mn kilos finland,1
contract includes design construction delivery equipment installation commissioning,1
financing arrangements enable company ensure line treasury policy sufficient financial instruments disposal potential capital requirements,2
merging two free sheets clarify market situation,1
outotec delivery covers engineering supply construction circulating fluid bed calcination plant capacity tons alumina per day,1
machines cease production end february,1
paper companies negative territories stora enso r shedding pct eur upmkymmene pct eur mreal b pct lower eur,0
cost savings rise mln eur year oko said,2
invention released patent office said noncoherent search matrix formed said correlation function matrix,1
port facilities throughput teus mln tons general cargo,1
russia wants utilise huge forest reserves different way done far,1
technopolis europe leading operator technoparks,2
rest week tapings jimmy kimmel live canceled back feet,1
net sales totalled eur million operating margin,1
ahlstrom share quoted nasdaq omx helsinki,1
five different game modes coop tournaments player splitscreen multiplayer modes players much fun would actually fishing,1
cargotec corporation press release august finnish time cargotec macgregor business area providing marine cargo handling offshore load handling solutions received significant offshore crane retrofit order,2
pine oil project related upgrade chemical recovery plant upm pulp mill kymi southern finland,1
sampo housing loan bank unit finland sampo bank priced eurbn usd bn bond reuters reported,1
new production line completed contract production hormone treatments,2
mreal corporation stock exchange announcement september pm kyro corporation mreal corporation metsaliitto group subsidiary agreed arrangement gives mreal option purchase kyroskoski natural gas powerplant kyro,1
thanks multiplying effect wagon performance transport much efficient says development manager juha malkia vr cargo,2
customers chance make bookings services want one location said mikko tuomainen incharge finnair internet sales,2
maggie ramsey wait thousands oregon washington guides anglers others flock frequent seminars nearly,1
several large stocks tacked lower however,0
helsinki eliiv today reported eps eur increase eps eur,2
contract covers installation training startup services,1
done logistics largest order norway diversified group said,2
net sales healthcare trade business eur million eur million operating profit eur million eur million,1
complete name shareholder otto henrik bernhard nyberg information please contact maijaliisa friman ceo tel,1
jun boy genius report delivered newstex nokia nyse nok n huh,1
finnish property investment company citycon plans issue directed subordinated convertible bonds institutional investors,1
aspo plc stock exchange release february esl shipping ltd part aspo group signed new longterm contract rautaruukki corporation marine transport raw materials baltic sea,2
aim achieve eur mn yearly savings,2
company operates worldwide employs total approximately persons,1
financial impact estimated meur annual improvement division result starting fiscal year,2
no service pricing details disclosed,1
group posted net sales mln euro mln operating profit euro mln,1
sale allow campofrio focus recently announced takeover groupe smithfield holdings european unit smithfield foods inc sfd us,1
terms agreement bunge acquire raisio keiju makuisa pyszny duet brands manufacturing plants finland poland,1
master business administration mba,1
january traffic measured revenue passenger kilometres rpk went capacity measured available seat kilometres ask rose,2
dinner conference program also viewed live audio webcast internet pages wwwcityconcom,1
talks aimed restructuring operations cutting costs,2
operating profit net sales sixmonth period increased respectively eur eur compared corresponding period,2
building complex consists highquality office retail space totalling square metres company said,1
alexandria va dec united states patent no issued dec assigned nokia corp espoo finland,1
korhonen dismissed post editor chief group newspaper lapin kansa december,0
sales fell abroad increased finland,1
company net sales eur million today approximately employees finland estonia poland,1
site cover six hectares,1
customer cooperative retailer osuuskauppa suursavo,1
nokia music store begins trading tuesday selling singles albums well live music streaming,1
national sponsors big read include national endowment arts cooperation institute museum library services arts midwest,1
extraordinary general meeting expected take place no later february,1
sound experience project deliveries large multipurpose complexes sports arenas says sami eronen svp infrastructure northern europe ruukki construction,1
patrizia adds acquisition portfolio already worth eurbn,1
cash flow business operations totalled eur mn compared negative eur mn first half,2
annual report contains financial statements consolidated financial statements report board directors auditor report,1
nokia oyj production site bochum germany posted profit interest mln eur capital reported excerpt article released tomorrow citing internal documents,1
australian company mirabela nickel awarded outokumpu technology contract grinding technology nickel sulfide project bahia state brazil,2
operating profit fell eur mn eur mn third quarter,0
stora enso owns percent bergvik earns therefore sek bn value appreciation,2
aviation systems maintenance based kansas generated net sales usd million,1
international electronic industry company elcoteq laid tens employees tallinn facility contrary earlier layoffs company contracted ranks office workers daily postimees reported,0
upmkymmene said not indicated interest domestic consolidations,1
contract covers supply temporary heating equipment lkab new pellet plant kiruna northern sweden,1
q consolidated earnings tax totaled eur compared eur net profit eur compared eur previous year,2
however broker gave outperform recommendation stock,2
total order value booked fourth quarter remainder booked second quarter,1
geosentric acquiring extra financing issuing maximum new shares convertible bond subscription rights shares fully subscribed,1
board established remuneration committee following members sari baldauf chairman tapio hintikka heikki westerlund addition board decided appoint nomination committee later stage,1
seppala transferred sale greater extent last year february reflected january sales figures,1
finnish raute precision large glass batch plant mortar plant orders mexico us,2
sanoma learning literature offering print digital learning materials present eleven countries,1
however march government st petersburg passed front part building area square metres land plot hotel worth usd mn company delta,1
small investors voiced fears shares end risk investors,0
video marimekko design manager noora niiininoski explains brands natural fit timeless style,1
paper mill central maine town madison soon new owner,1
yit baltic sales first three quarters totaled million euros representing drop percent year year,0
tieto looking energy solution would best support idea sustainable development happy able provide solution saysjouni haikarainen vice president fortum,2
seppala revenue increased eur finland revenue went eur sales abroad rose eur sales increased baltic countries well russia ukraine,2
company poser wants impress people latest handset,1
sami seppnen ceo elisa eesti says novel network allows fast mobile broadband sparsely populated areas,1
company said supply wcdma ghspa radio network including modular high capacity nokia flexi wcdma base station east java bali sumatra batam,2
raute listed nordic exchange helsinki,1
acquisition teliasonera would france telecom biggest since purchase orange plc billion billion would create world fourthlargest telecom company behind att inc verizon communications inc ntt corp japan,1
newspaper best sales asset high quality journalism journalistic content,1
value contract eur mn,1
