text,label
operating profit lower outlook published earlier,0
net sales lehdentekijat unit approximately eur million employees,1
community gardening become popular activity especially raise vegetables,1
alfa group voting stock new company telenor free float,1
eur mn net interest income,1
januarynovember group sales totalled eur mn drop period,0
include software development internet mobile telephone content communications valueadded software financial services security applications systems integration electronics ebrd informed,1
fiscal year ending september revenue customers million around transportation group revenue,1
aldata help retailers ensure merchandising selections reflect customer demand evolving shopping behavior,1
last job losses related reductions take place,1
previously company expected financial performance remain level,1
london afx fortum said agreed sell industrial maintenance service operations funds managed capman undisclosed sum,1
according original merger plan scanfil would get stake combined business,1
cet arcelormittal lost eur euronext paris coming lead bluechip fallers,0
profit taxes eur mn compared eur mn previous year,2
donations universities annual general meeting authorized board directors donate max,1
finnish silicon wafer technology company okmetic oyj omx helsinki okmv said wednesday september invest eurm sensor wafer business,1
aspo net sales totaled eur million,1
consolidated operating profit continuing operations decreased eur mn eur mn,0
operating profit rose eur mn eur corresponding period,2
aldata share space optimization vision apollo user group category management association conferences company unveil new solution combines business intelligence space planning data conferences,1
pretax profit rose eur mn eur corresponding period,2
ahlstrom employees serve customers via sales offices production facilities countries six continents,1
second successful effort financial investor year,2
first contract envisaged construction three ferryboats option two units confirmed total value mln euro mln,2
following issue new shares constitute percent firm capital,1
unit prices straddle carriers vary eur eur company added,1
deal means ten persons three countries transfer tieto,1
consumption forecast grow,2
marathon percent stake plx said according bloomberg,1
also turned earnings per share eps eur versus loss per share eur,2
see slide show newest product releases fiskars,1
bids offers include least shares value shares must correspond least eur,1
tomtom given assurances continue sell maps competitors wins eu approval,2
member hk ruokatalo group finland scan launching joint venture slaughterhouse team ugglarp skne southern sweden,1
harold w young independent broker working closely several retailers including ahold usa market basket cvs bj wholesale club hannaford cumberland farms,1
construction volumes meanwhile grow rate percent annually,2
metso delivery include complete coated board line related air systems two winders,1
usbased corp talks scandinavian telecoms company teliasonera sell stake uzbek cellular operator coscom executive coscom told interfax,1
business divested generates consolidated net sales eur million annually currently employees,1
finnish suominen flexible packaging cutting jobs unit tampere two nastola finland,0
adpnews sep finnish silicon wafers maker okmetic oyj hel okmv said reduce number clerical workers worldwide result personnel negotiations completed today,0
based negotiations personnel indicated willingness move new location,1
metso paper delivery comprise advantage dct tissue machine including quality control distributed control systems qcsdcs,1
boomeranger boats oy specialises boat building designs manufactures sells customised rigid inflatable boats rib primarily baltic sea market,1
original name componenta ml subsidiary finnish componenta group changed ml components company seen growth q comparison q,2
bosse added trygvesta not financial strength acquire entire unit,0
mreal plans discontinue production standard coated fine paper hallein gohrsmhle mills,1
may finnish company lemminkainen oyj hel lems said today construct office building toolonlahti downtown helsinki without disclosing financial details,1
finnish consulting engineering group poyry plc omx helsinki poy said wednesday october awarded contract tanqia dibba fzc ownerengineer wastewater system dibba emirate fujairah uae,2
operating profit totalled eur mn eur mn yearonyear,2
october finnish fishing tackle company rapala vmc corp hel rapv said today net profit rose eur first nine months eur period year earlier,2
operating profit grain trading increased eur mn eur mn,2
board directors proposed extraordinary general meeting authorise board decide issuance maximum mn new shares one share issues,1
growth net sales first half compared first half,2
result distribution companies start distribute addition current product offering shimano reels rods shimano fishing tackle products exclusive basis,2
developers project predict completed april skanssi attract million visitors annually,2
espoon kaupunki awarded contracts personal care products,2
new types network elements added network conversion file updated adding information required converting message format new network element type format understood management system,1
dubai nokia announced launch comes music groundbreaking service introduces new way people enjoy music,2
energyefficient data center built combining effective energy solution stateoftheart technology,2
successful requires providing level quality satisfies customers partners,1
companies keep commercial independence continue market traditional products individually,1
mr mika korpinen apac vice president comptel concludes comptel demonstrating importance providing reliable delivery enabling timetomarket,1
oil shale feedersupply solution deliver crushed oil shale shale oil refinery already operation well novel enefit shale oil technology processing plant,1
restrictions not apply statutory dividends,1
currently quarterly applied surcharges differ significantly actual market prices,1
cosmetics collection includes eye shadow face powder lip gloss mascara accessories,1
tikkurila acquired majority stake kolorit paints autumn,1
com constantly planning new ways serve customers online comprehensive basis says matti leminen president anttila oy,2
capacity facility made finland vaahto group tons light coated paper,1
berling capital umo capital veikko laine biggest shareholders amanda capital,1
looking forward contribute srv success competence says taneli hassinen,2
mkel demanding new board company well discussions merger alma media media company talentum,1
fullfunction pc weighs kilograms measures slightly two centimeters thin,1
fourth quarter net sales increased eur mn eur mn fourth quarter,2
moreover konecranes kito intend transfer hoist distribution business konecranes japanese joint venture mhs konecranes kito,1
talvivaara secured year offtake agreement per cent main output nickel cobalt norilsk nickel entered longterm zinc streaming agreement nyrstar nv,2
operating cash flow investments totalled eur mn compared eur mn corresponding period,0
request finnish media company alma media newspapers research manager jari kaivooja finland futures research centre turku school economics drawn future scenario finland national economy using model developed university denver,1
measures included increasing synergies economies scale within grimaldi group personnel adjustments divestments redelivery excess tonnage,1
stonesoft sees great promise future ipv,2
sales security system packaging increased slightly,2
transaction tikkurila no powder coatings related operations,1
company estimates trend demand sports equipment steady amer report said,2
first industrial seek leed designation uponor new building squarefoot speculative distribution center first park lakeville,1
raw materials prices surged past year fueled part rapid industrialization china india developing nations,0
addon order contains among others control valves instrumentation well complete mill engineering electrification metso drive controls,1
far mr galvan able avoid laying workers,2
secondary antenna also used reception high power signal radar calibrate transmission channels radar,1
makes wide range mobile devices services software enable people experience music navigation video television imaging games business mobility,1
ramirent net sales second quarterended june euro million us million percent increase compared euro million thesecond quarter last year,2
district court helsinki dismissed charges court first instance,2
stora chief executive jouko karvinen described russian tariff hikes threat future forest products industry finland,0
virala oy ab allocated board directors amount eur million eur million lower maximum announced,1
pilot project proved rifd technology ideal purposes comments olli saarinen material handling supervisor yara,2
ruukki delivery volumes selling prices showed favourable development company comparable net sales grew yearonyear eurm ceo sakari tamminen said,2
addition tulikivi corporation also currently member board following companies altia corporation jrvisuomen portti osuuskunta osuuskunta kpy profile vehicles oy voimatel oy,1
insurance policies simple,1
group said intends initiate within year process buyout minority shareholders ragutis aim becoming sole owner company,1
tekla group net sales approximately million euros operating result million euros,1
order also covers design services hardware software licences well maintenance services six years,1
result merger largest professional electronics telecommunications technology contract manufacturing center finland formed sievi,1
network test business part elektrobit test automation business segment employs people finland people abroad mainly us asia,1
return investment compared negative,2
ramirent danish subsidiary ramirent today signed agreement acquire business assets machinery rental company jydsk materiel udlejning located west jutland,2
aim ceo qa sessions give clarity information made public already earlier,1
srv raise holding company summer majority,2
last year finnair recorded percent growth asian sector carrying million passengers two continents,2
tekla structures product box needed made recycled material,1
finnish broadband data communication systems provider teleste oyj hel tltv said yesterday returned net profit eur million usd first nine months versus net loss eur period,2
program included operational improvements reductions personnel mainly netherlands,1
part plan board directors decided transfer maximum shares held company share issue payment directed aspo management oy holding company acquired management,1
rushydro agreement transfer stakes oesk five ercs trust management inter rao,1
international operations accounted net sales,1
founded fiskars years product quality excellence finland oldest company,1
would huge process,1
airline targeting travel agents tour operators travel management companies raise awareness first targeting consumers added,1
sampo plc jarmo salonen head investor relations group communications tel distribution nasdaq omx helsinki principal media financial supervisory authority wwwsampocom announcement distributed thomson reuters behalf thomson reuters clients,1
componenta objective agreement increase business existing production lines,2
geneva feb tero aaltonen finland developed radio resource control method,1
design team long admired marimekko vivid patterns colors,2
helsinki thomson financial kemira growhow swung profit first quarter earnings improved sales especially fertilizer business europe normally stronger first quarter,2
stichting pensioenfonds abp shares representing share capital voting rights,1
elisa commissioned finland poyry telecom oy conduct study reception estonia largest cities besides tallinn,1
lifted veil various types customer designs phones result social stereotyping taken fine art,1
press conference lattelecom board chairman nils melngailis explained blackstone chosen experience sector well financial strength,2
purchase sites worth million thames gateway provide homes,1
tornio works employs scope fixedperiod parttime temporary layoffs apriloctober period,0
significant challengers market logset samporosenlew,1
committee proposes following remuneration monthly remuneration eur chairman eur deputy chairman eur board members,1
part eseries business promise nokia e equipped variety email solutions small stylised package said dave grannan general manager enterprise solutions nokia,1
following registration number issued outstanding shares basware,1
net profit period euro million,1
finnish insurance company fennia kesko group ending loyal customer cooperation,0
eqt completed exit salcomp finnish company makes mobile phone chargers selling remaining stake swedish investment group nordstjernan euro million million,1
unlisted british biologicals makes b proteins diseasespecific supplements cover diabetes hepatitis asthma cardiovascular ailments,1
personnel expertise high level technology play major role exel composites operations,1
capman finnish alternative asset manager made acquisition helsinkifocused vehicle real estate fund fund bought sevenstory office built underwent refurbishment end,1
fair value capman plc investments september amounted meur,1
last quarter componenta net sales doubled eurm eurm period year earlier moved zero pretax profit pretax loss eurm,2
feeling quite positive region whole,2
milan afx italian shipping group grimaldi increased stake finnish company finnlines pct pct held june according news agency ansa,1
please inform ir johanna koskinen participation no later april telephone conference financial analysts investors conducted english begin pm finnish time eet,1
adpnews feb finnish real estate investor sponda oyj hel sdav said today slipped net loss eur million usd profit eur million,0
eero katajavuori currently group vice president human resources take yearlong sabbatical starting october,1
net sales however increase,2
finnish forest machinery manufacturer ponsse issued profit warning,0
pm omx helsinki pct omx helsinki pct lower mln eur turnover,0
efficiency improvement measures january finnish stationery gift retailer tiimari hel tiiv said today continue improve operational efficiency focusing profitable core operations,2
ahlstrom share quoted nasdaq omx helsinki,1
company publish financial statement february,1
sales tiimari segment fell yearonyear eur june,0
decisions made quickly possible,1
established srv group private finnish construction concern operations finland baltic countries russia,1
helsinki thomson financial mreal said exercise option buy mw natural gas power plant land kyroskoski finland around mln eur kyro oyj,2
company board directors propose dividend eur annual general meeting,1
finnish lifting equipment maker konecranes oyj said july net profit rose mln euro mln first half mln euro mln period,2
rapala excited partnering rbff industry leaders holiday promotion,1
divestment line company plans focus selected growth segments streamline corporate structure company explained,2
eb hold exclusive rights market new entity product,1
together yahoo nokia said continue deliver internet experiences address core needs consumers developers operators advertisers,1
ssh communications security corporation headquartered helsinki finland,1
online ice chart shows no ice area estonia sea ports coast gulf finland,1
efore plant saarijarvi central finland one largest employers region,1
tekla structures installation built according microsoft requirements windows certification company added,1
thus group balance sheet eur goodwill company added,1
decision resolve meego stronger continued,2
warmly welcome,1
revenues time grew percent million euros,2
confirmed view july,1
company profit totaled ls,1
reuse back pet bottles also steadily increased rate use strapping tape picked dip petcore said previously,2
one uponor promising future products hydronic cooling system,2
manufacture cpps undertaken existing export oriented unit eou wartsila factory khopoli near mumbai,1
market share widened percent percent year earlier,2
driver left car suspect kidnapped forced gunpoint drive durham,0
according scanfil demand telecommunications network products fluctuated significantly third quarter situation expected remain unstable rest year,0
agreement pfizer funding biotie research activities pde phosphodiesterase inhibitor program since start late sole authority develop discovered compounds,1
harju elekter founded leading producer electrical equipment materials baltic states,1
shares represented total share capital total voting rights,1
utility also provide services related electricity management hedging trades risk management reporting,1
shares acquired accordance section rules nasdaq omx helsinki rules applicable acquisition shares,1
finnish rautaruukki engineering division ruukki engineering reorganise operations mo rana plant norway,1
earlier reported nokian tyres building plant town vsevolozhsk russia leningrad region annual production capacity million tires,1
representative body swedish meats approved improved offer finnish hk ruokatalo acquire company,2
relocation ragot already started completed next weeks waterqueen tortue moves planned mid vmc europe third quarter,1
operating profit eur mn eur mn,2
firm generated sales mln eur,1
said contract estimated contribute eurm net sales,2
value firm forestry holdings increased sek bn,2
helsinki finland sept globe newswire ixonos plc expands company smartphone rd services establishes new nextgeneration smartphone design unit connection ixonos site jyvaeskylae,2
deal likely bring savings eur mnmn,2
estonia agriculture minister helirvaldor seeder finland twoday visit course meet finnish counterpart sirkkaliisa anttila,1
sweden oversupply pharmacies,0
purchase pay solutions enable companies gain visibility control businesscritical financial processes,1
first time finnair awarded agreement uk government,2
wins acceptance december finnish industrial machinery company metso oyj hel meov said today complete takeover offer textile company tamfelt oyj abp hel tafks acquiring shares votes,1
ms laakso responsible hkscan hr functions development group smarket areas,1
building home improvement trade sales decreased totalling eur mn,0
addition indian market new plant serve salcomp customers globally company said,2
cash flow operations recent quarter also reached eight year low,0
insurance division turned eurm profit,1
altimo previously agreed similar deal telenor merge stakes vimpelcom kyivstargsm,1
stockmann department store total floor space square metres stockmann investment project price tag eur million,1
local waste management company turun seudun jtehuolto planned set tonne wasteburning facility,1
nasdaqlisted yahoo inc introduced new service enables malaysians take favorite internet content services mobile phones,2
companies signed letter intent sale september envisaged seal actual agreement january,1
total capacity factory approximately engines year,1
finnish samporosenlew manufactures approximately seven forest machines monthly half machines exported,1
nordea sees return positive growth baltic countries,2
operating profit totalled eur mn eur mn year,0
contrast company net loss third quarter contracted eur million eur million corresponding period year ago,2
grew finland norway denmark baltic countries,1
natural source isoprene tree species hevea brasiliensis also known rubber tree,1
opening portal part expansion strategy alma media marketplaces business unit,1
company turnover amounted meur,1
itunesbased material accessible windowsbased macintosh computers transferable portable devices including apple ipods,2
order included wartsila order book second quarter company added,1
difficult become google analytics channel partner,1
customer forwarded site unknown logged first number,1
market share percent according ac nielsen data,1
atria said offer would give swedish company continued ownership control slaughtering cutting operations,1
acquisition basware preliminary pro forma net sales amount eur mn preliminary pro forma operating profit amounts eur mn,1
unit planned operational second half full stream,1
composite body coated hard coating layer produced thermal spraying coating ground,1
turbines expected launched end,1
german commerzbank ag hamburg branch us jp morgan nyse jpm participated arrangers dutch ing ams inga coarranger,1
implementation programs negative impacts earnings mr meiklejohn said,0
company strength apetit brand,2
previously projected figure slightly lower,1
work assignment already started due completion spring,1
anttila online department store netanttila established position bestknown visited shopped online store finland,1
approximately dwt vessel ordered india,1
social networking locationbased service trends comprise significant share internet traffic today appealing mid users,1
jeder betatester erhlt kostenlos sechs monate lang updates und hat laut eigener aussage die mglichkeit die finale version zu beeinflussen,1
authorization force period months resolution general meeting,1
clothing chain seppl net sales increased eur mn,2
finnish textiles clothing company marimekko corporation omx helsinki mmov reported wednesday november operating profit eur net sales eurm period january september,1
music provided major international regional labels including universal music group sony music entertainment warner music emi music rotana mazzika melody music platinum records leading content aggregator orchard well thousands independent labels,1
planned set class business center two top storeys complex,1
pohjola act manager issue bond listed nasdaq omx helsinki ltd,1
agreed company board directors available advisory role,1
bond value eurm maturity years,1
finnish publisher alma media hel alnv said wednesday decided extend eur usd apiece mandatory tender offer media group talentum hel ttmv started august november,1
company said started investigate streamlining operations order meet tightening competition mobile phone charger market,2
stockholm march cybercom cybercom group hightech consultancy offers global sourcing endtoend solutions,1
london afx intertek group plc testing inspection company said commercial electrical division bought finlandbased company natlabs oy etteplan oyj mln eur cash,1
aspocomp said spin chinese indian units equipment salo plant finland newlyformed unit sell hong konglisted meadville,1
order valued usd,1
one one time targeted june guess pushed back maybe crazy feel like nt leaked enough meet date point,1
see new post inspiring challenge,1
pharmaceuticals netherlands brandnew market analysis gives clear overview actual situation future outlook pharmaceutical market netherlands,1
adjusting present situation cutting capacity costs without however jeopardising asia strategy longer term,1
kone shares dropped percent xac us helsinki,0
business sales euro million million responsible sales marketing lanxess paper chemicals business kemira bought euro million early year cw jan p,1
appointments force new ceo appointed,1
patrick jeambar also continue responsible innovation health safety environment hsea functions ahlstrom corporation,1
beers olvi retained market position,1
tiimari latvian representative ineta zaharova said company earned lvl profit times,2
efore ceo reijo maihaniemi said company developed already delivered power supply units respective systems based technology chinese sector company zte corp,1
maximum grade veneer yield calculated based dimensions grades veneer products well iterating places peeling axes simulating peeling process,1
nokia announced launch bicycle charger kit compatible nokia phones mm charging interface,1
solvency capital ratio companies times solvency limit,1
igor oleg yankov currently manage moron vitim hold onto stake,1
according schmardin nordea likely try win customers pension fund providers,2
finnish forest machinery equipment maker ponsse oyj said october deliver total cuttolength method forest machines harvester heads brazilian paper maker bahia pulp unnamed uruguayan wood harvesting contractors,2
operates three distinct brands united supermarkets market street united supermercado,1
meantime ceo duties assumed outotec deputy ceo seppo rantakari,1
according nordic financial group nordea analyst sami sarkamies makes nokia portfolio competitive,2
one opportunities would bring baltic meat processing rakvere like processing concentrated vantaa meatpacking unit finland paper wrote,1
july market cap segments updated according average price may,1
finnish mreal kyro mill starting negotiations cut staff,0
growth activeness talentum customers started end continued reporting period company stated,2
sanoma magazines expects net sales level,1
global markets direct pohjola bank plc financial analysis review indepth business financial analysis pohjola bank plc,1
platen edges contact band provided seal protrusion directed towards middle area platen means provided exert maintain pressure volume defined platen band seal,1
technopolis st petersburg telecommunications university russian support fund legislative initiatives signed protocol intent may year set technopark st petersburg base st petersburg telecommunications university,1
capital structure solidium may complemented financial instruments future,1
company turned earnings per share eps eur versus loss per share eur,2
meanwhile nokia said able deliver complete range services deployment operations consulting integration managed services result buyout,2
new production lines novator mill veliky ustjug vologda oblast sveza change current birch plywood production targeting domestic market produce overlaid birch plywood global market,1
talvivaara mining company plc talvivaara mining lse talv finlandbased nickel mining business installed second production line metals recovery plant june,1
