text,label
homeowners across north america green experiences share cost savings clean ecofriendly heating,1
finnish construction company lemminkainen oyj hel lems said yesterday would build plastic film extrusion plant packaging materials supplier ab rani plast oy lemminkainen kaluga industrial park russia,1
according ceo kai telanne company newspapers achieved best financial result ever,2
decision means temporary layoffs fixed duration company nastola jyvaskyla units southern central finland respectively,0
today orange scissors iconic symbol excellent ergonomic design superior quality associated every product fiskars,1
comptel corporation sami ervio president ceo distribution nasdaq omx helsinki major media comptel dynamic oss solutions enable telecom service providers deliver services flexibly charge effectively,1
negotiations reduction persons taken place natural redundancy termination fixedterm contracts,1
new shares subscribed stock options shareholder rights commence date entered trade register,1
company main shareholders lihakunta itikka osuuskunta made commitment acquire shares worth eur mn,1
terms financing approved annual general meeting company held june,2
corresponding share capital increase eur entered trade register today,1
fl group private equity division manages operating companies including icelandair group fl travel group bluebird sterling,1
nokia said next generation mobile gaming platform makes easy people find buy play share rich immersive games range nokia devices,1
line run fully underground comprise stations executed two implementation stages,1
soapstone deposits medvezhyegorsk area expected increase tulikivi current reserves considerably,2
lember said matter topical also estonia bill drafted social affairs ministry would scrap oldage pensions favorable conditions,1
basware headquartered espoo finland,1
finnish construction group lemminkainen oyj hel lems said today contract provide technical services nevsky centre shopping mall opened november st petersburg russia,2
enterprise value fray bentos pulp mill forestal oriental totals approximately euro billion upm said,1
new delhi feb korteniemi anneli helokunnas tuija peltola marjo keskinen jukka salminen jussi tusa kia janhonen risto nokia telecommunications oy espoo finland developed cable adjustment device,1
wednesday announced government would propose granting licence two reactors one built fennovoima tvo,2
lietuvos respublikos sveikatos apsaugos ministerija awarded contract uab affecto lietuva financial systems software package,2
found however driver involved twocar accident,1
company offers payroll services including payroll processing payroll tax administration employee pay services including direct deposit check signing readychex,1
company also expects sell products russian region,2
biohit inc expanded mline family pipettors addition new ml volume range,1
upmkymmene upgraded inline underperform goldman sachs,2
survey goodyear third valued tyre brand followed continental bridgestone,1
largest elevator market world chinese output elevators continued rise units yronyr,2
roshan net sales million ebitda million,1
third applicant fortum dropped,1
make available following brandnew market analyses cement uk cement poland cement belgium analyses give clear overview actual situation future outlook cement industry european countries,1
applying summer work seen laborious stressful,0
among biggest christmas sellers satin bow shift dress styled outfits worn victoria beckham paris hilton prom dress,1
deutsche beteiligungs well private equity fund manages first bought mce secondary buyout white plains ny financial investor andlinger co,1
aim understand different traffic patterns based use building,1
company plant russia continue make tyres near markets plant nokia finland manufacture tyres markets,1
consumers increasingly interested heir phones,1
year dividend deducted subscription price,1
ecommerce site flagship managed marimekko north america retail llc subsidiary established us last year,1
implementation important operator since launch fixedtomobile convergence service brazil see brazil may,1
earnings per share eps first half amounted eur eur year ago,0
mr skogster currently serves manager responsible abb oy system modules low voltage drives,1
salcomp manufacturing oy pay eur million cash salcomp connection implementation sale transfer business,1
navteq commanding lead installed map data systems north american vehicles may leader turnbyturn navigation data offered services onstar north america said analyst phil magney telematics research group minnetonka minn,2
mr mcdonald started evening set featuring hits solo career doobie brothers years selection rb cover songs met mixed results,1
adanac molybdenum canada ordered grinding technology molybdenum project british columbia canada shalkiya zinc kazakhstan awarded contract grinding technology shalkiya zinclead project kazakhstan,2
adp news feb finnish retailer kesko oyj hel kesbv said today total sales excluding value added tax vat stood eur million usd january yearonyea,0
baltic countries sales fell,0
nokia also negotiating product portfolio new company,1
finland paper paperboard reclaimed,1
systeemitiimi sales project resources also strengthened director paul skogberg said,2
swedbank hypotek issue benchmark fixed rate covered deal euros maturing january,1
acquisition supports strategy close customers around world offering equipment related services,2
southfield mich central corporate credit union distribute patronage dividends members waiving service fees incurred months july november tune estimated million,2
note clients published dutch broker described company third quarter results soft although also noted elcoteq retained guidance dealers said,1
investments span across various product investment types including retail hospitality office residential interests realestate portfolios nonperforming loans corporate restructurings,1
pleased welcome tapeks noma cramo group,2
growth expected continue,2
oppohjola group capital adequacy ratio act credit institutions stood tier ratio,1
acquisition part ramirent strategy strengthen position selected locations,2
choose giant countdown red head rainbow trout giant shad rap perch color,1
following issue number shares swedish company grow,1
january largest nordic bank nordea finnish retail chain stockmann launched regionally unique cooperation project first introduce common mastercard credit card enabling payments different states stores,1
previously plant expected completed end,1
supported nokia phones include n ngb n nn n n n n n n n n n n n n n e e e e e e eei e e e touch xpress classic navigator classic navigator xm,1
raute headquartered nastola finland technology company serving wood products industry worldwide,1
exel headquartered mantyharju finland,1
line plans focus selected growth segments streamline corporate structure,2
basis competitive bidding ooo kitai stroi russian subsidiary china state construction engineering corporation construction company owned china state selected main constructor,1
patronage refunds reward members use feebased services make positive contribution cencorp operating results said bill walby cencorp ceo,1
winner not present win,1
last quarter best quarter net sales operating margin rose,2
deal subject approval norwegian competition authorities,1
years color orange become synonymous quality,1
rinkuskiai raised sales percent million liters sales kauno alus grew percent liters,2
think,1
finnish electronics contract maker incap oyj said january sold manufacturing facilities helsinki local real estate company sponda oyj mln euro mln,1
price raw material aluminium went end company considers outlook favourable,2
put costly cell phone towers thinly populated areas balloons would,1
investments operational changes enable additional optimisation working hours thereby cost savings,2
poyry energy gmbh austria leading engineering consulting company energy infrastructure environment sector owned poyry plc austrian verbund ag,1
cencorp would focus development manufacture marketing standard products production automation,1
combines perfect price performance sophisticated management facilities company said,2
new partnership agreement represents significant milestone parties,2
swot analysis one method categorization weaknesses,1
outotec net profit second quarter jumped mln euro mln mln euro mln year ago,2
figure not include food exports finland,1
tanks delivered company currently building chemical tank farm antwerp northern belgium,1
desk reach full planned strength ten persons autumn,1
lt also made commitment redeem remaining shares end,1
operating profit continuing operations fell eur mn eur mn first half,0
incap headquartered oulu finland electronics contract manufacturer employees finland estonia india,1
value order eur mn,1
production plant based neste oil proprietary technology use flexible input vegetable oil animal fat,1
says brian burton head security vodafone uk,1
operating profit decreased nearly eur mn however,0
operating profit margin compared year earlier,0
following information released comptel tomorrow chairman federal communications commission scheduled deliver national broadband plan congress,1
fair value investment properties eur million,1
go bed worrying every night said,0
around reductions implemented pension arrangements,1
company said investments new market areas resulted sales increase sweden poland russia lithuania,2
panostaja treats negotiating partners entrepreneurs selling life work newcomer entrepreneurs seeking career fairly justly according law,1
finnish silicon wafer technology company okmetic oyj omx helsinki okmv reported thursday october operating profit eur januaryseptember eur corresponding period,2
december amer announced dismissal ceo roger talermo headed company since,1
company split two parts coming months essent owning operating production supply enexis owning operating grid,1
loss financial items totalled eur mn compared profit eur mn corresponding period,0
spokesman said food store center subject council local support could comprise supermarket smaller store niche outlets firmed following consultation council local community regarding appropriate uses occupiers,1
aim convert plants flexible manufacturers new technologically demanding products,2
polish business employs people net sales eur mn,1
need ready window opens rosberg said,1
growth beer consumption took place far east latin america africa,1
april finnish machinery rental company ramirent oyj hel rmrv said today acquired assets sector player stavebni doprava mechanizace sdm czech republic undisclosed sum,1
company confirmed estimate lower revenue whole yearago eur given interim report august,0
addition company considering start production russia,1
business boomed ostrom helped plant small story rapala lures life magazine issue featured marilyn monroe cover,2
financial statement first quarter tikkurila reported discontinued operations,1
according finnish insurance companies tapiola local insurance group lhivakuutus pohjola two fierce storms end july beginning august felled trees around finland speeded sales forest insurance,2
manager critical politicians failure differentiate beleaguered european financial institutions skandinavian banks sailed crisis without issues,1
new chairman board directors mr chaim katzman give presentation answer questions,1
finland hamina cargo terminal finnish nurminen logistics purchased warehouse ground lease rights port hamina,1
net sales decreased eur mn eur mn corresponding period,0
stonesoft global provider proven next generation solutions simplify network security management,1
finnish larox signed contract talvivaara project delivery filters talvivaara nickel mine sotkamo finland,2
company said offshore segment represented total marine engines orders julyseptember period merchant special vessels cruise ferry ship design respectively,1
ova press stake joint venture imsm holds stake,1
viking line manages well current ferries,2
diesel margin remained high,2
three students universiti sains malaysia study trip helsinki,1
orders received grew yearonyear eurm,2
device volume area decreased mn units,0
company moved operating profit eur versus operating loss eur also turned eps eur versus loss per share eur,2
company said observed current stabilisation prices potential higher prices deliveries first quarter,2
scanfil holdings include contract electronics manufacturer scanfil ems group,1
lithuanian beer makers sold million liters beer rise per cent yearearlier figure million liters,2
contract covers new energyefficient ac drives designed cooperation companies,1
finnish food industry companies interested opportunities provided ukraine,1
outotec scope delivery covers engineering supply special equipment services calcination plant two circulating fluid bed calciners,1
interim report first quarter published may,1
kesko agro eesti retailer wholesaler grain agricultural warehousing machinery accessories net sales million euros increase onetenth preceding year,2
operating profit eur mn loss eur mn year earlier,2
floor area yliopistonrinne project sq building gross area total sq total facilities let,1
nokia nokia pioneer mobile telecommunications world leading maker mobile devices,2
according lnnen tehtaat ceo matti karppinen company aims deliver fish products customers day earlier currently,1
helsingin uutiset vantaan sanomat lansivayla reach readers consumers greater helsinki region,2
published globes online israel business news wwwglobesonlinecom november copyright globes publisher itonut ltd,1
gsk announced november would close operations dartford,0
operating profit margin increased,2
finnish sports equipment maker amer sports oyj hel ameas said today net loss narrowed eur million usd second quarter eur million corresponding period year earlier,2
new production plant company would increase capacity meet expected increase demand would improve use raw materials therefore increase production profitability,2
residentialconstruction particular picked several markets,2
financing aspocomp growth aspocomp aggressively pursuing growth strategy increasingly focusing technologically demanding hdi printed circuit boards pcbs,2
wartsila contract october plant installed manturovo kostroma region russia km northeast moscow russia,2
company employees annual turnover eur vaahto group listed nordic exchange helsinki,1
nonwovens specialty papers made ahlstrom used large variety everyday products eg filters wipes flooring labels tapes,1
business area operations finland sweden denmark estonia latvia lithuania,1
operating profit rose eur mn eur mn,2
signing total amount aspo revolving credit facility agreements eur million replaces formerly valid agreements eur million,1
depending market situation projects sold years completion,1
risto raty tekla executive vice president said tekla structures archicad cover entire design documentation workflow throughout construction project,1
airbus attempt evacuate people within seconds,1
aldata solution oyj thomas hoyer cfo information aldata solution oyj thomas hoyer cfo tel aldata brief aldata solution one global leaders supply chain software retail wholesale logistics companies,1
corrensponds percent okmetic share capital voting rights,1
recent technology deliveries include refinery technology anrak aluminium iron ore pelletizing plant tata steel iron ore sintering plants bhushan steel,1
aim develop opensource application solutions,1
insurer axa par cs slid eur citigroup ing slashed targets stock,0
share capital alma media corporation business id eur divided shares,1
zao yit moskovia builds housing moscow surrounding cities,1
measures result weak demand shipbuilding industry,0
pertti ervi independent company major shareholders,1
water treatment products australia today global research data services going publish market analysis market chemical water treatment products australia,1
contract worth eur million,1
steve jackson ebusiness analyst satama former ceo aboavista said google broke mold gave away google analytics free,1
meeting media analysts held day stonesoft headquarters helsinki italahdenkatu interim report presented stonesoft ceo ilkka hiidenheimo,1
aspocomp large factory china factory building project india halted due financing problems,0
ahlstrom corporation seppo parvi cfo distribution main media wwwahlstromcom ahlstrom brief ahlstrom global leader development manufacture marketing high performance nonwovens specialty papers,1
sysopen digia plc press release february ibm finland rewarded distinguished partner companies,2
total new citycon shares nominal value eur per share subscribed april exercising abc options based company stock option plan,1
offer challenging interesting employment people countries throughout europe,1
member board numerous companies shareholder boardman ltd board specialist network,1
according shipping company viking line eu decision significant financial impact,1
realignment interests sector clearly way,2
net sales expected remain level,1
also chile important market area forest machine companies,1
raute reported loss per share eur first half eps eur corresponding period,0
metso expects net sales increase comparable exchange rates,2
sponda plc stock exchange release december eur billion syndicated credit facility sponda sponda signed agreement oneyear syndicated credit facility total eur billion,2
tekla organize information meeting analysts media wtc helsinki marski meeting room aleksanterinkatu day pm light lunch served,1
maximum obligated total trades per day isk market value,1
following divestment fiskars outdoor unit comprise brands gerber silva buster focus multitools knives compasses mobile lighting pedometers aluminium boats,1
sanoma magazines net sales estimated grow,2
shares held company number outstanding shares voting rights attached shares amounts thus,1
founded bioview automates laboratory tests especially diagnostic tests cancer,1
air traffic finland stoppage since,0
employer together health personnel supports quitting pays part cost nicotine treatments,1
according mreal ceo mikko helander transaction enable company proceed swiftly restructuring program,2
poyry plccompany announcement december pm pursuant poyry plc stock option program new shares company subscribed since october stock options b,1
less ten people face pension agreements,1
report profiles companies including many key niche players including major nonwovens manufacturers ahlstrom corporation asahi kasei corporation buckeye technologies inc ei,1
permanent layoffs plywood sawn timber sectors finnish company operations several domestic mills earlier year temporarily laid workers save costs,0
also city insurance company p c insurance said not pay compensation,0
validating fgvoip client symbian signed represents significant step forward accomplishing goal,2
outsourced scan capture solutions transfer paper invoices electronic format basware business transactions service allows customer receive send invoices electronic format,1
revenue grew percent euro million us million euro million,2
name buyer not disclosed,1
januaryseptember operating profit totaled eur mn,1
ollipekka kallasvuo elected vice chairman board,1
revenues business reached nok million,1
shares nokia corp rose thursday cell phone maker said thirdquarter earnings almost doubled share global handset market increased,2
number collection errors fell considerably operations speeded,2
transaction line aspo strategy expand baltic sea region eastern markets,2
activities range development natural resources retailed marketing finished products,1
last july group said intended relocate warehouse office space loudeac saint marcel morvillars east france already operates hook manufacturing distribution unit,1
subdivision made sales revenues last year eur million eur million operating profits eur million eur million,2
incap contract manufacturing services pvt ltd subsidiary incap corporation finland acquiring manufacturing unit tvs electronic ltd tumkur near bangalore rs crore,1
trading code eliv number shares priceshare gratuitous transfer elisa holds total shares,1
electricity consumption grows higher frequencies,1
adp news feb finnish printed circuit board pcb maker aspocomp group oyj hel acgv said today swung net profit eur usd versus net loss eur million,2
leipurin growing rapidly internationalizing group,2
profit period eur mn compared eur mn,2
merrill lynch analyst campbell morgan upgraded recommendation paperlinx neutral buy may,2
started software capable retrieving data typed computer keyboard keyloggers complex mechanisms arrived scene phishing pharming,1
customers left powerless,0
sdm offers general rental equipment aluminium scaffolding power generator hoists customers construction sector,1
sale savcor group ltd comprise savcor art corporate function investment cencorp corporation,1
phones targeted first time users growth markets,1
russian gas giant invested another million litas company late owns percent stock capital amounts million litas,1
singapore may july finnish air carrier finnair oyj hel fias said today open daily route singapore may part growth strategy asia,2
finnish konecranes trying acquire italian fantuzzi manufacturer gantry cranes reach stackers,1
third original participants dropped due nausea side effects,0
result taxes decreased nearly eur mn compared nearly eur mn previous accounting period,0
finlandbased international machinery rental company ramirent plc omx helsinki rmrv said friday may president ceo kari kallio informed board intention retire year,1
program target structural cost reductions eur mn,2
disappointment see plan folded,0
happy working rapala encourage boaters anglers introduce newcomers sport said rbff president ceo frank peterson,2
handset maker not disclose financial details,1
sanoma magazines finland net sales grew eur mn eur mn,2
thank jarmo ukonaho warmly contribution wish best future challenges,1
steel industry accounted percent cargo volumes transported whereas energy industry accounted percent industries percent,1
company also featured ethibel pioneer investment register included innovest global list world sustainable corporations,2
orion net profit third quarter decreased mln euro mln mln euro mln year earlier,0
past decade gradually divested noncore assets bought several sports equipment makers including californiabased fitness products international sparks nevadabased atec leading maker baseball softball pitching machines,2
nokia said outcome fair responsible social plan,1
pretax loss totalled eur mn compared profit eur mn,0
devices would launched chinese market late company said,1
size extension already let gross area sq sq ft,1
deal includes rental equipment related merchandise rental contract depot two employees company said,1
category marked maturity recession,1
according prosecutor share transactions carried hk ruokatalo proceeded negotiations concerning acquisition swedish meats,1
metso foundries jyvaskyla oy discontinue production line september,1
eq bank forecasts olvi net sales eur mn second quarter operating profit eur mn,1
beef imports fell slightly mn kilos,1
group sales period eur million eur million profit taxes eur million,1
purchase operations part yit strategy expand offering building system services geographically,2
profit accounting period eur mn,1
end number outlets rise,2
city invite however public procurement tender tailormade public furniture park benches litter receptacles public toilets well bus shelters street lights,1
scanfil execute temporary layoffs midoctober job cuts march,0
sanoma also executive committee accordance company articles association prepares proposals matters decided noted board directors,1
kone annual net sales eur billion approximately employees,1
addition reduction nine persons made pension arrangements company added,1
center offers comprehensive range device design services spanning electronics mechanics software design full range testing laboratory services,1
russia top container shipping group fesco finnish logistics company nurminen logistics started pilot project offering clients direct intermodal transportation service finland asia pacific countries fesco said statement,2
mreal sales expected increased yearonyear eurm second quarter,2
reported net sales approximately eur mn,1
vianor sells tires cars trucks well range car parts provides maintenance services,1
end sanoma news wants secure foundation savings,1
major part deliveries include different ac cxe amplifier solutions products dinh telecom company acquired teleste last spring,1
tecnomen convergent charging solution includes functionality prepaid postpaid billing charging rating voice calls video calls raw data traffic type content services mobile fixed networks,1
part agreement aspocomp also give meadville pct slice subsidiary operating oulu finland,1
honkarakenne oyj worldleading manufacturer genuine wooden homes sponsoring finnish crosscountry skier virpi kuitunen next three years,1
mreal corporation stock exchange release august pm mreal received eur million cash payment sappi mreal corporation part metsliitto group divested graphic papers business sappi limited end eur million,1
turnover rose eurm eurm,2
net interest income increased eur mn eur mn,2
tekla structures bim building information modeling software developed according longterm plan improved user experience process functionality,2
fivestorey ecoefficient building gross floor area sq also include apartments,1
agreement larox transfer employees within engineering documentation related delivery projects product maintenance finland etteplan january,1
managing director kari inkinen says sponda leasing operations developed highly favourably,2
nokia bought chicagobased navteq acquiring maps database compete google maps well navigation device companies tomtom nv garmin ltd,2
