text,label
stock market news live stock sink despite blowout january job data,0
stock market update financials sector turn negative amid lower yield,0
stock market update future point lower open amid trade noise target lowes rise,0
stock market update future slip record high front january employment report,0
stock market update global stock give back gain,0
stock market update market pares gain chipmakers stay strong,0
stock market update semiconductor stock underperform ice call ebay interest,0
stock market update stock market set open lower target lowes gain,0
stock market update stock market slip session low,0
stock market update stock pull back open despite encouraging employment data,0
stock market update stock see muted response confirmation uschina trade progress,0
stock market update stock set lower open strong week job report top expectation,0
stockindex future extend loss jobless claim producer price data,0
stockindex future pare gain report china concern trade deal,0
stockindex future turn lower,0
stock plummeting fortunately jimcramer break,0
stock close dow 009 nasdaq 011 sp 007,0
stock close dow 015 nasdaq 033 sp 018,0
stock open dow 036 nasdaq 027 sp 022,0
stock close lower trade creates choppy session heidi_chung,0
stock close mostly lower earnings concern,0
stock face 50 odds correction 2020 vanguard davis say,0
stock finish lower paring loss usmexicocanada trade pact sp500 index marketscreener,0
stock give gain expert weigh state market via tradingnation,0
stock given back gain nasdaq turned negative,0
stock dow 43222 point nasdaq 11122 sp 4390,0
stock open lower amid fear trade impasse,0
stock open slightly lower investor parse trade news,0
stock open slightly lower investor remain uncertain trade deal,0
stock poised pause record run,0
stock retreat record open job report,0
stock squeeze gain friday investor dont fully buy china trade deal,0
stock suffer shocking week fed balance sheet unexpectedly shrink,0
stock wobble early trade energy pull back,0
stock bond dollar stumble trader reach peak fomo,0
tech trader hedge uschina deal prospect tech roundup economy marketscreener,0
market seeing strong taxloss selling investor focus price action worried,0
dow closed 26 point lower today 01 900 point earlier trading session,0
dow gave nearly 940point gain stockmarket rally stumble headed close,0
last time chinese stock performed poorly country middle massive market meltdown,0
sky falling entire cryptocurrency market crash,0
trade fear produced yet another pop vix index,0
u equity pared gain climbing fresh record investor digested latest view federal reser,0
u stock future fall worry china trade talk,0
u stock market open lower hotterthanexpected job report,0
u stock finish lower trade deadline loom,0
u stock give back gain end modestly lower sp500 index marketscreener,0
u stock open lower,0
u stock waver viral outbreak claim life sp500 index marketscreener,0
utility treasury yield rise utility roundup economy marketscreener,0
virus uncertainty weighs global share newscomau,0
vix warns imminent market correction,0
volatility made appearance today dow gave 1000point rally volatility sword cut way,0
wall st volatility raise fear another selloff sampp500 economy marketscreener,0
wall street slammed brake one 2019s hottest stockmarket fund,0
wall street pull back record high fourday rally,0
wall street slip investor look concrete detail trade deal,0
wall street slip record high job report,0
wall street slip record high open job report,0
wall street warning get louder everything rally back,0
watch dow drop 500 point worry grow economic impact coronavirus,0
weekend review 1124 confirmed uptrend major index week breaking 7 consecutive week,0
bull market may teeth left,0
china market set reopen u trader ignoring two blatantly obvious issue,0
cotton future trading lowest level since 2010 virus force clothing retailer shut store,0
sumrx asian market close nikkei 08 hang seng 15 shanghai 07,1
sumrx asian market close nikkei 20 hang seng 21 shanghai 21,1
sumrx european market update dax 05 ftse 09 cac 04,1
sumrx european market update dax 41 ftse 38 cac 31,1
sumrx overnight summary world market rise following positive trade talk commentary weekend,1
reason dont panic 401k stock plunge dow 13 low,1
alex gerkos xtx market doubled profit last year,1
major index finished day green number new coronavirus case u appeared slo,1
major stock index hit record intraday high heel trump tweet,1
big thanks carlquintanilla catching market typo end dow 65401 point nasdaq,1
another day another set record high sp 500 closed 06 nasdaq closed 1 reaching,1
another new stock market record enjoy,1
another week another vix record short,1
asia share bounce hope best uschina trade economy marketscreener,1
asia share bounce hope best uschina trade,1
asian market inch ahead u job report,1
asian share jump hong kong prodemocracy candidate score major victory,1
asian share mostly higher hang seng jump stimulus expectation,1
asian share rise phase one trade deal fan confidence,1
asian share soar amid trade optimism,1
average edge higher,1
average soar hope pandemic may peaking,1
average 5 afternoon action,1
cee marketsforint regains ground rate meeting lead fx higher,1
china tariff cut buoy stock investor look beyond virus,1
china tariff cut set power wall street record high,1
cnbctv18 market highlight sensex end 163 point higher nifty hold 12100 psu bank index 26 cnbctv18,1
despite backandforth trade news market continues grind higher,1
dow add 1600 point investor hope coronavirus case peaked,1
dow sp 500 open record china cut tariff,1
dow break 28000 calamatta cuschieri maltatoday,1
dow break 28000 malta independent online,1
dow future gain 129 point 04 sp 500 rise 13 point 04,1
dow future gain 57 point 02 sp 500 rise 4 point 01,1
dow future 73 point 03 sp 500 future rise 8 point 02,1
dow industrials climb past 28000 first time chron,1
dow industrials end around 175 point higher 06,1
dow industrials surge 1600 point start challenging week marriottinternational stock marketscreener,1
dow industrials surge 1000 point start challenging week marriottinternational stock,1
dow rally sign coronavirus pandemic slowing worldwide,1
dow surge 1000 point dowjones30 index marketscreener,1
dow 02 sp 500 rise 01,1
dow 110 point 04 open,1
dow 121 point 04 sp 500 gain 11 point 04,1
dow 25 point 01 nasdaq 22 point 03,1
dow sp 500 future around 02,1
dow sp 500 turn positive,1
emerging marketsstocks currency edge hope uschina trade pact,1
european market soar boris johnson victory,1
european share edge higher amid uschina trade worry,1
european stock get boost fed dot plot ecb decision awaits,1
european stock jump record high,1
financials sign creditmarket stability financials roundup economy marketscreener,1
week sp rose 07 dow 04 nasdaq gained 09,1
ftse gain 2 big tory victory,1
future higher ahead q3 result,1
future point fresh record u stock monday,1
future,1
future global market soar second day virus fear fade dollar slide,1
global market asian share rise phase one trade deal fan confidence,1
global share gain oil rise caution lingers uschina deal,1
global stock gain china move boost intellectual property right index marketscreener,1
goldman say political gridlock propel stock 2020 united fall divided rise,1
health care boost risk appetite buoy biotech co health care roundup economy marketscreener,1
hope v nope dow soar 1000 point gold spike near 1700,1
sp 500 rally 7 highest since march 13,1
macau sector rally positive trade news,1
market recovery attempt strengthens sp 500 knife toward next test,1
market volatility bulletin stock get reprieve yet another 5 day finance economy market,1
market may get boost cheery black friday consumer sentiment seasonal strength,1
market may rally tariff relief outshines tradepact letdown,1
market rocket back politico spy,1
mexican stock rose pledge u lawmaker swiftly approve new trade deal u mexico c,1
midafternoon market update nasdaq rise 2 myomo share spike higher,1
midmorning market update market open higher schwab td ameritrade confirm 26b merger,1
money market inflow beat longterm inflow last month morningstar,1
saudi arabian banking stock climbed even main local gauge fell ahead saudi aramcos giant listing,1
nasdaq record high investor look past coronavirus impact supply chain,1
nasdaq record high investor look past coronavirus impact supply chain,1
nasdaq climb 03,1
nasdaq close 21 point 02 higher,1
nasdaq composite hit intraday record,1
nasdaq hit new high investor look beyond coronavirus,1
nasdaq hit new high,1
nasdaq open 34 point 04 higher,1
nasdaq rise 42 point 05,1
nasdaq touch intraday high 8545,1
nasdaq 02,1
nasdaq 14 point 02,1
nasdaq100 future 43 point 05,1
nasdaq100 future gain 28 point 03,1
nasdaq100 future 04 data,1
philippine stock may pick yearend profit gdp,1
positive technical divergence forming weekly chart dow sp 500 nasdaq,1
pound stock jump uk election talk uschina deal,1
rally go china cut u tariff,1
sp 500 add 9 point 03 open,1
sp 500 dow le 01,1
sp 500 nasdaq composite trade record close,1
sp 500 briefly turn positive,1
sp 500 close around 07 higher nasdaq gain 11,1
sp 500 coast thanksgiving week follow stock seeking alpha finance market trading,1
sp 500 etf spy hit new 52week high,1
sp 500 06 dow 04 nasdaq 09,1
sp 500 dow nasdaq turn positive,1
sp 500 nasdaq close record high dow end 170 point,1
sp 500 nasdaq close record high dow end 170 point,1
sp 500 nasdaq hit fresh record high china signal ip law reform emily_mcck,1
sp 500 nasdaq notch record end week market weighs merit limited china tradedeal,1
sp 500 nasdaq touch record stock close higher solid earnings,1
sp nasdaq reach new closing high 3rd day rally,1
safehavens rise coronavirus concern stock rebound,1
south korean philippine indonesian stock first asia pacific enter technical bull market,1
stock buyback jump 63 q3 2019 sp dow jones say,1
stock future advance china ip announcement emily_mcck,1
stock future move higher trade deal hope rise economy marketscreener,1
stock future move higher trade deal hope rise,1
stock market live update sp 500 nasdaq dow post record closing high yahoo canada finance,1
stock market live update sp 500 nasdaq dow post record closing high yahoo finance,1
stock market live update stock reverse loss china say phase one deal done,1
stock market live update wall street set new high despite home depot kohl,1
stock market live wednesday sp 500 era coronavirus selloff tesla 2nd worst drop ever cnbc,1
stock market news live stock hit record high china announces plan cut tariff 75 billion u good,1
stock market update future edge higher despite weakness home depot retailer,1
stock market update future extend last week record run,1
stock market update future extend rally china say cut tariff,1
stock market update future gain back bullish momentum,1
stock market update global stock extend gain,1
stock market update nasdaq double percentage gain sp 500,1
stock market update track record,1
stock market update sp 500 perk,1
stock market update stock market edge higher start week,1
stock market update stock market lifted megacap tech,1
stock market update stock market open firmly higher tech stock lead,1
stock market update stock market open slightly higher energy stock pull back,1
stock market update stock market open slightly higher retail drag,1
stock market update stock market primed gain open,1
stock market update stock market set higher open despite relative weakness retailer,1
stock market update stock set higher open following trade update deal,1
stock market update stock high trade headline heat,1
stock market update wholesale inventory decline december,1
stockindex future point slightly higher amid positive trade development,1
stock extending gain last hour trading dow 6,1
stock close dow 039 nasdaq 016 sp 021,1
stock close dow 060 nasdaq 113 sp 073,1
stock open dow 021 nasdaq 048 sp 026,1
stock bounce back record territory,1
stock bounce china confirms trade deal u,1
stock bounced today positive coronavirus news here 3 market expert say follow along th,1
stock climb record high china deal optimism,1
stock edge higher sp 500 end sixweek streak weekly gain,1
stock gain china cut tariff investor look beyond virus,1
stock gain u economy signal strength update sp500 index marketscreener,1
stock grab another round record wall street par trade news,1
stock hit session high trade optimism,1
stock near record high pound waver election result,1
stock dow 113198 point nasdaq 38955 sp 13597,1
stock dow 12052 point nasdaq 4 sp 591,1
stock dow 34510 point nasdaq 8849 sp 3225 here whats moving market,1
stock dow 473 point nasdaq 1791 sp 204 here whats moving market,1
stock dow 70483 point nasdaq 16539 sp 7215,1
stock open slightly higher upbeat trade hope merger activity,1
stock open slightly higher upbeat trade hope merger activity,1
stock premarket dow 8638 point nasdaq 2750 sp 725 here whats moving market,1
stock rallied second day sp 500 index venturing briefly bullish territory,1
stock rally china lauds major progress trade negotiation,1
stock rose china moved step intellectual property protection investor hope may address key c,1
stock rose slightly friday president trump said u china close reaching trade,1
stock rose today building strong gain previous session spoke 3 expert here h,1
stock start solid gain tech strong early leader,1
stock start solid gain tech strong early leader,1
stock hit 52week high monday,1
stock turn positive ahead china press briefing,1
stock bond yield climb strong job report sp500 index marketscreener,1
strong economic data nudge stock higher,1
tech investor rush back speculative area tech roundup economy marketscreener,1
technical indicator lateyear bull trend confirmed sp nasdaq,1
thats new 52week high russell 2000 small cap nearly caught upsp ytd 256 russell 2000 ytd 214,1
dow closed 162746 point higher 7 number new coronavirus case u appeared slow,1
dow rallied 6 today investor react early sign lockdown u europe may helping,1
dow 1000 point kind wild swing dominated market past month,1
sp 500 nearly 25 2019 history show momentum could carry next year cnbc,1
sp 30 handle,1
sp 09 energy best performing sector xle 18 double sp,1
frantic rally market open wall street dow shot 1000 point boosted hope,1
sp 500 comeback stock could ride higher trader agree via tradingnation,1
today free feature technical take market lift twoday range indu spx compq iwm iyt tnx uup,1
uk stock rally british pound recovers optimism possible virus containment offset worry johnson,1
u market hit record level recently whats next move,1
u market jump open,1
u stock staging remarkable twoday rally many analyst calling recent run rally within b,1
u stock,1
u stock edge higher trying extend winning streak sp500 index marketscreener,1
u stock gain tradetalks optimism sp500 index marketscreener,1
u stock open higher risk appetite improves sp500 index marketscreener,1
u stock open higher,1
u stock resilient last week coronavirus roils china business stock trading,1
update u stock rose friday recovering three consecutive session loss,1
u stock best day two week closing near session high optimism slowdown new coronavir,1
u stock remain near session high early afternoon apparently nothing derail positive market sent,1
u stocksfutures gain china fuel trade deal optimism,1
wall street bounce back steep selloff here expect next via tradingnation,1
wall street hit record high trade hope rise,1
wall street hit record high report u close china trade deal deadline loom,1
wall street open higher report spark trade deal hope,1
wall street rally continues dow sp 500 open 3 market open,1
wall street rise modestly sp500 economy marketscreener,1
wall street set higher open trade deal hope build,1
wall street surge china financial measure soothe virus worry,1
weekly market update good corporate result counter virus fear weeklymarketupdate marketscreener,1
watch today dow set huge jump rocketing 1600 point higher,1
world largest pension fund gain stock foreign debt,1
sp500 head bull win tail bear lose read investing market business,2
sumrx asian market close nikkei 06 hang seng 06 shanghai 05,2
talkx market briefing momentum maintained despite disappointing news,2
selloff bond amid improving economic fundamental could bring cyclical stock back spotlight,2
algos buying bond algos buying stock,2
asia petrochemical monthly price watch report 2019,2
asia stock open mixed trade detail awaited market wrap,2
asian share mixed amid caution uschina trade talk,2
asian stock u equity future yen treasury dip hong kong stock outperform trump say he ver,2
asian stock see modest gain treasury yield dip u dollar hold overnight decline oil slip opec f,2
asian stock set open mixed trade deal market wrap,2
open 11252019,2
open 2102020,2
open 2102020,2
open 262020,2
open 272020,2
average end flat,2
average end flat,2
open,2
bloombergs bill maloney watch sp 500 technical market digest slew trade headline,2
record high u stock last,2
cee marketscurrencies weaker stock grind higher amid uschina trade hope,2
china market open iowa caucus alphabet earnings 3 thing watch monday,2
consumer next shoe drop wall street ignores data decelerating hard,2
coronavirus update china toll skyrocket market calm amid government cash infusion,2
dasan zhone risk parameter change derivative market holiday foreign exchange dasanzhone stock,2
dow future 5 point le 01 sp 500 2 point 01,2
dow jones news microsoft reveals next xbox apple avoids tariff,2
dow jones today tradeinduced hangover,2
dow tag 28k dump catchdown bond gold,2
europe longest trading hour among major stock marketssome two hour longer u,2
general announcementaims apac reit secures 12year master lease largest tenant singaporeexchange,2
general announcementannouncement associated company first sponsor group limited citydevelopments stock,2
general announcemententry supplemental deed relation dc1 singaporeexchange stock marketscreener,2
general announcementimmediate report updated rating report midroog singaporeexchange stock marketscreener,2
general announcementloan facility obtained keppel pacific oak u reit singaporeexchange stock,2
general announcementmelco resort finance announces proposed senior note offering singaporeexchange stock,2
general announcementmonthly valuation asset utilisation cash singaporeexchange stock marketscreener,2
general announcementsasseur reit included ftse epra nareit global emerging singaporeexchange,2
general announcementsiic environment build 3800 tonne per day waste treatment proje siic stock,2
global marketsasian share mixed wait go elusive uschina trade deal,2
global share cautious ahead u job data report,2
here happened stock market monday,2
here happened stock market tuesday,2
india nafed tender purchase 100000 tonne corn,2
inflow capital sp 500 fund took 11 billion march,2
japan exchange feb 10 2020 ose deletion component issue tse mother index japanexchange,2
leveraged etf decay update get update business finance trading,2
london stock exchange allergan plc londonstockexchange stock marketscreener,2
london stock exchange cleansing notice londonstockexchange stock marketscreener,2
london stock exchange disclosure table londonstockexchange stock marketscreener,2
london stock exchange early redemption londonstockexchange stock marketscreener,2
london stock exchange form 83 londonstockexchange stock marketscreener,2
london stock exchange form 83 replacement abbvie inc londonstockexchange stock marketscreener,2
london stock exchange form 83 replacement allergan plc londonstockexchange stock marketscreener,2
london stock exchange notice event default londonstockexchange stock marketscreener,2
london stock exchange notice redemption londonstockexchange stock marketscreener,2
market conducive long volatility position jpmorgan,2
market scale new high topranked growth etf buy,2
market mixed trade news,2
midday market update tallgrass energy jump following acquisition news proteostasis therapeutic share plummet,2
midmorning market update market edge higher jabil beat q1 expectation,2
midmorning market update market mixed adobe earnings beat estimate,2
morgan stanley say forecasting next two month let alone 2020 hard right,2
mutual fund misfire market february 06 2020,2
mutual fund misfire market february 07 2020,2
mutual fund misfire market november 25 2019,2
nasdaq debtor distribution data nykredit realkredit nasdaq stock marketscreener,2
nasdaq oplysning om kommende ændring møns bank ledelse nasdaq stock marketscreener,2
nasdaq quarterly statistical bulletin vol 8 2 june 2019 content narrative nasdaq stock,2
nasdaq composite 01 sp 500 virtually flat,2
nasdaq private market set new annual transaction record 2019 streetinsidercom,2
netflix must add ad tier lose million user needham say via business,2
news highlight top global market news day newshighlights economy marketscreener,2
news highlight top global market news day newshighlights economy marketscreener,2
nyse closing bell conmedcorporation nyse cnmd celebrates new listing 50th anniversary,2
nyse closing bell executive guest greek american issuer day ring bell,2
nyse opening bell generac nyse gnrc celebrates 10th anniversary listing,2
hour,2
hour,2
premarket london easyjet profit line hammerson fire sale continues,2
sp 500 earnings upside 2020 primarily depend uschina trade deal say jp morgan,2
sp 500 v commodity market relative valuation market finance trading,2
sp dow fall nasdaq inch,2
share gain doubt linger uschina deal oil rise,2
odd divergence past two week asset class except stock reversing recent gain,2
stock market live update dow 180 coronavirus name fall uber best day ever,2
stock market live update stock end little changed lashed brexit uschina trade yahoo finance,2
stock market news november 18 2019,2
stock market news uber hit gas pinterest paint pretty picture,2
stock market update asia close mixed europe trade lower,2
stock market update average still mixed,2
stock market update early level,2
stock market update energy remains weak megacap tech remains strong,2
stock market update future little changed amid news limited trade agreement,2
stock market update future update,2
stock market update retail stock extend loss health care sector gain,2
stock market update sp 500 playing second place monday,2
stock market update sp 500 return flat line,2
stock market update stock market close little changed retail space hit,2
stock market update stock market open little changed energy stock remain weak,2
stock market update stock market slows job report beat expectation,2
stock market update stock market trade mixed home depot kohl weigh retail space,2
stock market update stock market trade flat start week,2
stock market update wall street close little changed phase one deal reached,2
stockindex future hold gain retail sale import price data,2
stock eke early gain retail name drag,2
stock finish mixed nasdaq log third consecutive alltime closing high,2
stock index edge higher day lower week,2
stock mixed amid conflicting trade report,2
stock mixed choppy trading day heidi_chung,2
stock wall street ended thursday session little changed investor avoided making risky bet amid lack,2
stock rose slightly friday headed first weekly decline amid uncertainty around uschina,2
stock fell 3year low week dec 13,2
stock little changed close despite news impeachment article drafted looming deadli,2
sugar trader hold tight india set roil market,2
tech retake leadership role chip cloud name moving higher see pattern seeking alpha,2
index served yardstick hong kongs rise rebound various crisis,2
latest u market,2
latest preopen analysis news data driving market pageone spy dia qqq,2
time canada stock market shine may 2020,2
usa stock market closed friday april 10 2020 observance good friday,2
week economic data release forecast advintltradeingoods advretailinventories,2
trade momentum rose september first time four month,2
trade momentum rose september first time four month,2
trading china etf soar trump upends tariff optimism,2
trading share treasury month january 2020 stock marketscreener,2
u equity edged higher european asian stock slipped investor sought gauge economic hit,2
u stock future hold modest gain housing report,2
u stock end higher friday sp 500 suffers weekly decline,2
u index best year since 2013 large cap active fund poised see worst year since 2016 bofa,2
utility underappreciated sector rowe price analyst say,2
wall street end near flat u china announce trade deal,2
wall street firm release 2020 sp 500 target,2
wall street hovers near record level boeing drag dow,2
wall street rally friday multiweek win streak end,2
week ahead black friday federal reserve powell,2
weekly market update waiting game continues trade weeklymarketupdate marketscreener marketscreener,2
ted spread telling investor credit market,2
voter key 2020 election state growing increasingly pessimistic economy coronavirus crisi,0
accept award behalf ethiopian eritrean ethiopian prime minister abiy ahmed receives,2
coup period tulsi gabbard slam u interference bolivia,2
impossible say serious economic model party manifesto economy would bette,2
tell parent get opinion facebook aoc say,2
happy really think he caught trump said fed chair jerome powell white house,2
brexit failure founded lie hypocrisy 4 friend behind bydonkeys crowdfunded hundred,2
close great progress made larry kudlow director national economic council discus wh,2
target here ukrainian say country spotlight u,2
realdonaldtrump repeatedly touted friendship china president xi jimcramer say berniesanders wo,2
chill real trudeau envoy china say huawei feud,2
unicorn rainbow kellyanne conway shrug bloombergs candidacy,2
great opportunity say thank president australia pm scott morrison comment call,2
president trump facing process unprecedented unfairness sam dewey,2
democrat getting hit slammed impeachment getting le le popular day kilmeade foxandfriends,2
