text,label
crowdstrike reported betterthanexpected fiscal q3 2020 result yesterday think beyond,1
davita healthcare dva top q4 earnings estimate,1
docusign sign another solid earnings result docu,1
opera limited beat earnings expectation here analyst think happen next,1
prospect capital psec meet q2 earnings estimate,1
restaurant brand intl top q4 estimate company clucking cylinder qsr qsr,1
result digi international inc beat earnings expectation analyst new forecast,1
result synaptics incorporated exceeded expectation consensus updated estimate,1
taubman center tco top q4 ffo revenue estimate,1
vista outdoor beat estimate improving firearm market,1
target earnings phenomenal,1
canada goose report result third quarter fiscal 2020,2
agilent q4 2019 earnings preview,2
akam akamai q4 2019 earnings preview,2
amcr amcor 1h 2020 earnings preview,2
amen amen property report q3 result,2
arkr ark restaurant report q1 result,2
ashtf ashtead group plcs ashtf ceo brendan horgan q2 2020 result earnings call transcript subscribe,2
bke buckle inc bke ceo dennis nelson q3 2019 result earnings call transcript get update,2
bl blackline inc 2019 q3 result earnings call presentation follow stock seeking al,2
bpiry piraeus bank sa bpiry ceo christos megalou q3 2019 result earnings call transcript read,2
bpiry bpird bpirf piraeus bank sa 2019 q3 result earnings call presentation subscribe seeking alpha,2
brbr bellring brand inc brbr ceo darcy davenport q4 2019 result earnings call transcript read,2
brbw brunswick bancorp report q4 result,2
bway brainsway ltd bway ceo david zacut q3 2019 result earnings call transcript continue reading,2
bxmt blackstone mortgage trust q4 earnings preview,2
ccrc china customer relation center report 1h result,2
ce celanese corp ce ceo lori ryerkerk q4 2019 result earnings call transcript,2
chtr charter communication inc 2019 q4 result earnings call presentation market finance trading,2
cna cna financial corporation 2019 q4 result earnings call presentation trading economy finance,2
coenf coeny contact energy report 1h result,2
conn conns inc 2020 q3 result earnings call presentation read sign update,2
crto criteo sa q4 2019 earnings preview,2
culp culps q2 result,2
cvx chevron corporation 2019 q4 result earnings call presentation trading stockmarket finance,2
dcmyy ntdmf ntt docomo inc dcmyy q3 2019 result earnings call transcript,2
dcp dcp midstream q4 earnings preview,2
dnzof dnzoy denso report q3 result,2
diamond offshore drilling inc ceo marc edward q4 2019 result earnings call transcript,2
diamond offshore q4 2019 earnings fleet status report analysis business stock investing,2
domo domo inc domo ceo josh james q3 2020 result earnings call transcript continue reading,2
dxlg destination xl group inc dxlg ceo harvey kanter q3 2019 result earnings call transcript read mor,2
eltp elite pharmaceutical report q3 result,2
enz enzo biochem report q1 result,2
exas exact science q4 2019 earnings preview,2
exc exelon q4 2019 earnings preview,2
ffic flushing financial corporation ffic ceo john buran q4 2019 result earnings call transcript,2
fl foot locker inc fl ceo richard johnson q3 2019 result earnings call transcript continue reading,2
flmp flame seal productsnbsp report q3 result,2
fran francescas holding corporation fran q3 2019 result earnings call transcript get update,2
gec great elm capital group inc gec ceo peter reed q2 2020 result earnings call transcript,2
geos geospace technology corporation geos ceo rick wheeler q4 2019 result earnings call transcript co,2
gps assessing gap earnings beat launch share higher get info seeking alpha,2
gt goodyear tire rubber q4 2019 earnings preview,2
hlt hilton worldwide q4 2019 earnings preview,2
hpe hewlett packard enterprise q4 2019 earnings preview,2
hth hilltop holding inc hth ceo jeremy ford q4 2019 result earnings call transcript,2
idt idt corporation 2019 q3 result earnings call presentation subscribe seeking alpha,2
iesc y holding inc 2019 q4 result earnings call presentation follow stock seeki,2
igc india globalization capital report q3 result,2
ingr ingredion q4 2019 earnings preview,2
isvlf impact silver report q3 result,2
itub itau unibanco report q4 result,2
itw illinois tool work inc 2019 q4 result earnings call presentation business stockmarket trading,2
ivc invacare corporation 2019 q4 result earnings call presentation business trading finance,2
jci johnson control international plc 2019 q4 result earnings call presentation,2
jec jacob engineering group inc 2019 q4 result earnings call presentation sign update seeking,2
jec jacob engineering q4 2019 earnings preview,2
jll jones lang lasalle q4 2019 earnings preview,2
jout johnson outdoors inc jout ceo helen johnsonleipold q1 2020 result earnings call transcript,2
jout johnson outdoors inc jout ceo helen johnsonleipold q4 2019 result earnings call transcript follo,2
juvf juniata valley financial report q4 result,2
jwcaf james e wagner cultivation report q4 result,2
kffb kentucky first federal bancorp report q1 result,2
klbay klabin sa klbay ceo cristiano teixeira q4 2019 result earnings call transcript,2
ktppf katipult technology report q3 result,2
litb lightinthebox holding co ltd litb ceo jian q3 2019 result earnings call transcript sign f,2
live live venture report fy result,2
logn logansport financial report fy result,2
lqdt liquidity service inc lqdt ceo bill angrick q4 2019 result earnings call transcript read,2
lrtef lanesborough real estate investment trust report q3 result,2
lscc lattice semiconductor q4 earnings preview,2
lyft lyft q4 2019 earnings preview,2
man manpowergroup inc 2019 q4 result earnings call presentation stock finance investing,2
ma masco q4 2019 earnings preview,2
matw matthew international corporation matw ceo joseph bartolacci q1 2020 result earnings call transcri,2
mdlnf centaurus energy report q3 result,2
mgddf compagnie gãƒânãƒârale de ãƒâtablissements michelin report fy result,2
mjarf mjardin group report q3 result,2
mmyt makemytrip q3 2020 earnings preview,2
mpaa motorcar part america inc mpaa ceo selwyn joffe q3 2020 result earnings call transcript,2
mrln marlin business service corp mrln ceo jeff hilzinger q4 2019 result earnings call transcript,2
nesrf nhrny northern star resource report 1h result,2
nm navios maritime holding inc 2019 q3 result earnings call presentation continue reading,2
nm navios maritime report q3 result,2
ntnx nutanix q1 2020 earnings preview,2
nugs cannabis strategic venture report q2 result,2
nvo nonof novo nordisk 2019 q4 result earnings call presentation finance investing business,2
nycb new york community bancorp inc 2019 q4 result earnings call presentation business market finance,2
okta okta inc okta ceo todd mckinnon q3 2020 result earnings call transcript read,2
okta okta inc 2020 q3 result earnings call presentation subscribe seeking alpha,2
ondk ondeck capital q4 2019 earnings preview,2
opxs optex system holding report q1 result,2
ottw ottawa saving bancorp report q4 result,2
pd pagerduty inc pd ceo jennifer tejada q3 2020 result earnings call transcript get update,2
peak healthpeak property q4 earnings preview,2
phr phreesia inc phr ceo chaim indig q3 2020 result earnings call transcript get update,2
pipr piper sandler company pipr ceo chad abraham q4 2019 result earnings call transcript,2
pnnt pennantpark investment pnnt ceo art penn q4 2019 result earnings call transcript get info,2
prekf prairiesky royalty report q4 result,2
pri primerica q4 2019 earnings preview,2
prosy prosf prosus nv 2020 q2 result earnings call presentation keep reading,2
ptozf plato gold report q3 result,2
pvg pretium resource q4 2019 earnings preview,2
rmr rmr group inc rmr ceo adam portnoy q4 2019 result earnings call transcript continue reading,2
see sealed air q4 2019 earnings preview,2
sjm j smucker company 2019 q2 result earnings call presentation get info seeking alpha,2
sol renesola ltd 2019 q3 result earnings call presentation keep reading market finance economy,2
sqns sequans communication sa sqns ceo george karam q4 2019 result earnings call transcriptâ,2
st sensata technology q4 2019 earnings preview,2
stmp inc 2019 q3 result earnings call presentation get update,2
sumrx earnings next week,2
sumrx earnings afternoontomorrow morning,2
tbbk bancorp inc tbbk ceo damian kozlowski q4 2019 result earnings call transcript,2
tfiff tfi international report q4 result,2
tgh textainer group holding q4 2019 earnings preview,2
tgna tegna q4 2019 earnings preview,2
tomz tomi environmental solution report q3 result,2
trauf transurban group report 1h result,2
usfd u food q4 2019 earnings preview,2
vnom viper energy q4 2019 earnings preview,2
vrex varex imaging q1 2020 earnings preview,2
vrns varonis system inc 2019 q4 result earnings call presentation finance stockmarket economy,2
wu western union q4 2019 earnings preview,2
zumz zumiez inc zumz ceo rick brook q3 2019 result earnings call transcript follow,2
4 thing look general mill report earnings,2
preview philip morris intls q4 earnings,2
abbvie wow q4 result,2
adm tronics unlimited report q2 result,2
advantego report q3 result,2
ag mortgage investment trust inc schedule fourth quarter 2019 earnings release conference call,2
agco report fourth quarter result,2
akbank ta report q4 result,2
aker solution asa report q4 result,2
albany international report fourthquarter 2019 result,2
alnylam pharmaceutical report fourth quarter full year 2019 financial result highlight recent period activity,2
alpha bank report q3 result,2
alpine 4 technology report q3 result,2
ambarellas q3 earnings preview,2
american resource report q3 result,2
american water announces 10 year capital spending plan set long term growth target announces 2020 earnings g,2
amkor technology report financial result fourth quarter full year 2019,2
api group corporation report q3 result,2
ark restaurant announces financial result first quarter 2020play_arrow arkrestaurants stock,2
ark restaurant announces financial result first quarter 2020,2
arrow electronics report fourthquarter yearend 2019 result,2
atico mining report q3 result,2
au optronics report q4 result,2
autonation q4 2019 earnings preview,2
azrieli group adr report q3 result,2
babcock international group report 1h result,2
banca monte dei paschi di siena spa report fy result,2
beach energy report 1h result,2
bergenbio report q3 result,2
biosyent report q3 result,2
bioteq environmental technology report q3 result,2
bonal international report q2 result,2
brighthouse financial announces fourth quarter full year 2019 result,2
brightview report first quarter fiscal 2020 result reaffirms full year fiscal 2020 guidance,2
bristolmyers squibb report fourth quarter full year financial result 2019,2
lowes recapture lost ground home depot earnings,2
canaccord genuity report q3 result,2
cancer genetics report q3 result,2
cannabis sativa report q3 result,2
cardiff lexington corporation report q3 result,2
cedar realty trust inc cdr q4 2019 earnings call transcript,2
cellect biotechnology report q3 result,2
celyad report q3 result,2
central european medium enterprise ltd report result full year fourth quarter ended december 31 2019,2
central european medium report q4 result,2
ciner resource lp release 4th quarter year cinerresourceslp stock marketscreener,2
cna financial corp cna q4 2019 earnings call transcript,2
cnfinance report q3 result,2
coloplast asb report q1 result,2
columbia sportswear company report fourth quarter record full year 2019 financial result provides 2020 financial outlook,2
commonwealth bank australia capital margin focus earnings preview commonwealthbankofaustralia stock,2
compass mineral report fourthquarter fullyear result,2
contact energy report 1h result,2
cordy oilfield service report q3 result,2
core molding report q3 result,2
coresite report fourth quarter 2019 financial result,2
credicorp report q4 result,2
cubic energy report q3 result,2
dassault systemes report q4 result,2
deluxe report fourth quarter 2019 result record full year revenue,2
idex corporation nyseiex recent earnings growth beat trend,2
dnb asa report q4 result,2
fdcs nsefdc earnings warrant attention,2
domtar corporation report preliminary fourth quarter fiscal year 2019 financial result,2
donaldson webcast second quarter 2020 earnings conference call,2
eagle point income company report q3 result,2
earnings preview expect home depot tuesday,2
earnings preview expect macys thursday,2
earnings scheduled december 12 2019,2
edited transcript 2882tw earnings conference call presentation 18nov19 900am gmt,2
edited transcript 8766t earnings conference call presentation 19nov19 700am gmt,2
edited transcript abeo earnings conference call presentation 13nov19 300pm gmt,2
edited transcript adnto earnings conference call presentation 31oct19 500pm gmt,2
edited transcript akba earnings conference call presentation 12nov19 200pm gmt,2
edited transcript alim earnings conference call presentation 30oct19 100pm gmt,2
edited transcript alphaat earnings conference call presentation 19nov19 430pm gmt,2
edited transcript amkn earnings conference call presentation 5nov19 1000pm gmt,2
edited transcript aptax earnings conference call presentation 28aug19 1230am gmt,2
edited transcript arwr earnings conference call presentation 5feb20 930pm gmt,2
edited transcript ashn earnings conference call presentation 19nov19 200pm gmt,2
edited transcript asnd earnings conference call presentation 18nov19 930pm gmt,2
edited transcript aspn earnings conference call presentation 31oct19 900pm gmt,2
edited transcript atkr earnings conference call presentation 22nov19 100pm gmt,2
edited transcript bdx earnings conference call presentation 6feb20 100pm gmt,2
edited transcript bmy earnings conference call presentation 31oct19 1230pm gmt,2
edited transcript brew earnings conference call presentation 13nov19 430pm gmt,2
edited transcript cb earnings conference call presentation 5feb20 130pm gmt,2
edited transcript cno earnings conference call presentation 6nov19 400pm gmt,2
edited transcript cpa earnings conference call presentation 14nov19 400pm gmt,2
edited transcript csl earnings conference call presentation 6feb20 1000pm gmt,2
edited transcript ctkn earnings conference call presentation 18nov19 100pm gmt,2
edited transcript ctsh earnings conference call presentation 5feb20 1000pm gmt,2
edited transcript dcmto earnings conference call presentation 18nov19 400pm gmt,2
edited transcript dssin earnings conference call presentation 13nov19 100pm gmt,2
edited transcript ekta bst earnings conference call presentation 15nov19 1000am gmt,2
edited transcript eros earnings conference call presentation 15nov19 130pm gmt,2
edited transcript ese earnings conference call presentation 19nov19 1000pm gmt,2
edited transcript esito earnings conference call presentation 12nov19 900pm gmt,2
edited transcript este earnings conference call presentation 7nov19 500pm gmt,2
edited transcript fcrto earnings conference call presentation 6nov19 700pm gmt,2
edited transcript fher3sa earnings conference call presentation 13nov19 300pm gmt,2
edited transcript fttto earnings conference call presentation 5nov19 400pm gmt,2
edited transcript gff earnings conference call presentation 13nov19 930pm gmt,2
edited transcript ggalba earnings conference call presentation 12nov19 400pm gmt,2
edited transcript glog earnings conference call presentation 6feb20 130pm gmt,2
edited transcript gluu earnings conference call presentation 5feb20 1000pm gmt,2
edited transcript gskl earnings conference call presentation 5feb20 200pm gmt,2
edited transcript gts earnings conference call presentation 7nov19 130pm gmt,2
edited transcript gtxn earnings conference call presentation 8nov19 130pm gmt,2
edited transcript hi earnings conference call presentation 14nov19 100pm gmt,2
edited transcript icon earnings conference call presentation 12nov19 1000pm gmt,2
edited transcript iwsy earnings conference call presentation 12nov19 930pm gmt,2
edited transcript jks earnings conference call presentation 19nov19 1230pm gmt,2
edited transcript kwr earnings conference call presentation 13nov19 130pm gmt,2
edited transcript lee earnings conference call presentation 12dec19 300pm gmt,2
edited transcript leve3sa earnings conference call presentation 18nov19 300pm gmt,2
edited transcript linc earnings conference call presentation 14nov19 300pm gmt,2
edited transcript lxp earnings conference call presentation 6nov19 130pm gmt,2
edited transcript mac earnings conference call presentation 6feb20 600pm gmt,2
edited transcript manu earnings conference call presentation 18nov19 100pm gmt,2
edited transcript mfa earnings conference call presentation 6nov19 300pm gmt,2
edited transcript mgp earnings conference call presentation 5nov19 530pm gmt,2
edited transcript mm earnings conference call presentation 19nov19 200pm gmt,2
edited transcript msg earnings conference call presentation 8nov19 300pm gmt,2
edited transcript nanool earnings conference call presentation 19nov19 730am gmt,2
edited transcript ncmax earnings conference call presentation 16aug19 1200am gmt,2
edited transcript ne earnings conference call presentation 31oct19 100pm gmt,2
edited transcript newn earnings conference call presentation 18nov19 100pm gmt,2
edited transcript ngl earnings conference call presentation 14nov19 915am gmt,2
edited transcript ngvc earnings conference call presentation 14nov19 930pm gmt,2
edited transcript nhi earnings conference call presentation 7nov19 500pm gmt,2
edited transcript nspr earnings conference call presentation 12nov19 130pm gmt,2
edited transcript ntrto earnings conference call presentation 5nov19 300pm gmt,2
edited transcript nvmi earnings conference call presentation 7nov19 200pm gmt,2
edited transcript nvuunto earnings conference call presentation 8nov19 700pm gmt,2
edited transcript ohlmc earnings conference call presentation 14nov19 500pm gmt,2
edited transcript otel earnings conference call presentation 6nov19 430pm gmt,2
edited transcript pirs earnings conference call presentation 11nov19 100pm gmt,2
edited transcript plzunto earnings conference call presentation 7nov19 700pm gmt,2
edited transcript ppc earnings conference call presentation 31oct19 100pm gmt,2
edited transcript pri earnings conference call presentation 7nov19 300pm gmt,2
edited transcript prosn earnings conference call presentation 7nov19 300pm gmt,2
edited transcript ptn earnings conference call presentation 13nov19 400pm gmt,2
edited transcript rlgt earnings conference call presentation 12nov19 930pm gmt,2
edited transcript rrr earnings conference call presentation 4feb20 930pm gmt,2
edited transcript sbph earnings conference call presentation 11nov19 930pm gmt,2
edited transcript sglb earnings conference call presentation 14nov19 930pm gmt,2
edited transcript slfto earnings conference call presentation 7nov19 300pm gmt,2
edited transcript tdg earnings conference call presentation 19nov19 400pm gmt,2
edited transcript tipt earnings conference call presentation 7nov19 200pm gmt,2
edited transcript twou earnings conference call presentation 6feb20 930pm gmt,2
edited transcript vkpa earnings conference call presentation 14nov19 530pm gmt,2
edited transcript vlapa earnings conference call presentation 31oct19 100pm gmt,2
edited transcript vnet earnings conference call presentation 19nov19 100am gmt,2
edited transcript ygyi earnings conference call presentation 18nov19 915pm gmt,2
edited transcript yrd earnings conference call presentation 15nov19 1200am gmt,2
edited transcript znga earnings conference call presentation 5feb20 930pm gmt,2
edited transcript zton earnings conference call presentation 19nov19 100am gmt,2
edreams odigeo sa report q2 result,2
elite pharmaceutical report q3 result,2
ellington residential mortgage reit report fourth quarter 2019 result,2
eltek report q3 result,2
emcor group inc fourth quarter conference call broadcast internet,2
encision report q3 result,2
endonovo therapeutic report q3 result,2
energy environmental service report q3 result,2
entercom communication report 2019 fourth quarter financial result host conference call february 25,2
everest group report full year fourth quarter 2019 result,2
exxe group report q2 result,2
falconstor software report q3 result,2
first saving financial report q1 result,2
flir system release fourth quarter full year 2019 financial result thursday february 27 2020,2
fortum oyj report q4 result,2
friendly hill bank report fy result,2
gilat satellite report q3 result,2
gormanrupp report fourth quarter fullyear 2019 financial result,2
graftech report unaudited full year fourth quarter 2019 result,2
grom social enterprise report q3 result,2
grupo aval acciones valores sa report q3 result,2
gtx report q3 result,2
havilah resource quarterly activity cashflow report ending 311019 havilahresources stock,2
healthpeak property q4 earnings preview,2
heico q4 2019 earnings preview,2
here like lannetts q2 earnings result,2
hexagon ab publ stohexa b recent earnings drop worry,2
hilton worldwide q4 2019 earnings preview,2
idorsia report q4 result,2
igc report financial result quarter ended december 31 2019,2
impact silver report q3 result,2
india globalization capital report q3 result,2
ing groep report q4 result,2
ingles market incorporated report sale net income first quarter fiscal 2020,2
innerscope hearing technology report q3 result,2
innovest global report q3 result,2
international isotope report q3 result,2
internet gold report q3 result,2
itau unibanco report q4 result,2
item 9 lab report q4 result,2
j2 global report fourth quarter year end 2019 result provides 2020 outlook,2
japan tobacco report fy result,2
jumia announce fourth quarter full year 2019 result february 25 2020,2
energy group inc je q3 2020 earnings call transcript,2
kala pharmaceutical report fourth quarter full year 2019 financial result host conference call,2
kentucky first federal bancorp release earnings,2
kinnevik investment abb report q4 result,2
klabin report q4 result,2
konatel report q3 result,2
konecranes report q4 result,2
kt corporation report q4 result,2
lattice semiconductor q4 earnings preview,2
lawson product inc report fourth quarter 2019 financial result,2
lee report q4 result,2
live venture report fy result,2
liveworld report q3 result,2
logansport financial corp report earnings three twelve month ended december 31 2019,2
magal security report q3 result,2
makemytrip q3 2020 earnings preview,2
manchester united plc announces second quarter fiscal 2020 earnings report date,2
marcus millichap inc report fourth quarter 2019 financial result thursday february 20 2020,2
martin marietta material q4 2019 earnings preview,2
maximus report fiscal year 2020 first quarter result,2
mediatek report q4 result,2
molina healthcare report fourth quarter yearend 2019 financial result,2
worthington q2 earnings,2
mphase technology report q1 result,2
msc industrial direct co inc nysemsm recent earnings drop worry,2
nathans famous report q3 result,2
navios maritime acquisition report q4 result,2
navios maritime report q3 result,2
neste oyj report q4 result,2
neurovive pharmaceutical ab report q3 result,2
new jersey resource report first quarter fiscal 2020 result,2
new residential investment corp announces fourth quarter full year 2019 result,2
newgioco report q3 result,2
nexus reit report q3 result,2
ngl energy partner lp announces record third quarter fiscal 2020 financial result,2
nice provides dialin detail fourth quarter full year 2019 result teleconference,2
nicholas financial report q3 result,2
nike earnings preview investor watch,2
nippon telegraph telephone corporation report q3 result,2
nmc health plc lonnmc recent earnings growth beaten longterm trend,2
nordea bank ab adr report q4 result,2
nordic semiconductor asa report q4 result,2
northern star resource report 1h result,2
old dominion freight line report fourth quarter 2019 earnings per diluted share 180,2
omnicom q4 2019 earnings preview,2
omv aktiengesellschaft report q4 result,2
onemain holding inc report fourth quarter 2019 result,2
osram licht ag report q1 result,2
ottawa saving bancorp report q4 result,2
outotec oyj report q4 result,2
owen minor report fourth quarter full year 2019 financial result wednesday march 4 2020,2
panoro energy asa report q3 result,2
petrotal report q3 result,2
phathom pharmaceutical report third quarter 2019 financial result provides corporate update,2
philip morris international inc report 2019 fourthquarter fullyear result,2
pjt partner inc report full year fourth quarter 2019 result,2
premium earnings 21020 mercadolibre armour blog,2
pretium resource q4 2019 earnings preview,2
protolabs report financial result fourth quarter full year 2019,2
public joint stock company gazprom neft report q3 result,2
pure bioscience report fiscal 2020 q1 financial result,2
puxin report q3 result,2
q1 earnings outlook tyson food,2
q1 earnings preview palo alto network,2
q3 earnings outlook tjx company,2
redhawk report q1 result,2
reminder altice usa hold conference call discus q4 full year 2019 result,2
ringcentral q4 2019 earnings presentation ringcentral stock marketscreener,2
ringcentral announces fourth quarter 2019 result,2
rrd announce fourth quarter result february 25th host conference call february 26th,2
saab ab report q4 result,2
sampo oyj report q4 result,2
securitas ab report q4 result,2
security national report q3 result,2
singing machine report q2 result,2
sirius xm holding inc released annual earnings here analyst think,2
sk telecom report fy result,2
skanska ab report q4 result,2
sonoco product company nyseson recent earnings growth beaten longterm trend,2
sonova holding ag report 1h result,2
spectacular solar report q3 result,2
strauss report q3 result,2
superior gold report q3 result,2
swisscom ag report q4 result,2
swk holding report q3 result,2
taronis technology report q3 result,2
teekay offshore partner lp q4 2019 earnings call transcript,2
tennant company webcast fourth quarter conference call,2
