text,label
highlight actual retail brokerage business small part schwabs business bcheungz say,2
highlight u consumer continued delever note angeloakcaps sam dunlap thats really w,2
highlight white house hosting listening session right vaping issue jessicaasmith8 say,2
highlight there certainly lot u bank say pilot test block chain,2
highlight there little like report wellsfargo acting chief economist jay bryson say ab,2
highlight unfortunately think going okay black friday ubs retail analyst jay sole say,2
highlight get better sense hit ultimately going earnings bad u,2
highlight really worried look like u year garnishgather founder emily,2
highlight think sameday twoday whatever day getting consumer want,2
highlight always looking way bring new minecraft experience community continues g,2
highlight dont copy amazon learn best practice author ram charan say three key element,2
highlight asahi kasei corporation senior executive officer john moyer investing autonomous driving build,2
highlight burke financial strategy ceo john burke explains healthcare favorite sector right,2
highlight carnival ceo arnold w donald discus new wearable technology enhance travel experience cruise,2
highlight chief ceo cb_childers discus woman workplace,2
highlight columbia threadneedle investment senior interest rate currency analyst ed alhussainy break,2
highlight democrat white house reach usmca deal one rare circumstance,2
highlight house democrat announce two article impeachment question persuaded american,2
highlight read unemployment data bcheungz break yahoo u,2
highlight michael bloomberg trying kind bring party together shift focus little bit,2
highlight plumb fund cio tom plumb explains he bullish healthcare,2
highlight call day morgan stanley tesla get closer 2024 start talking,2
highlight fed need improve dot plot need think alternative scenario say dartmouth,2
highlight fittest man earth mathewfras talk investing,2
highlight come private investing investing general earlier company higher ri,2
hillary tweet one law refuse accept lawsuit,2
history agreed upon collection lie havent seen high school history book 35 year would,2
hollywood box office boom even american stay home chill,2
hollywood know big carbon problem set,2
homebuilder arent keeping millennials,2
hong kong bank give extra day leave staff amid virus outbreak,2
hong kong bank give extra day leave staff amid virus outbreak,2
hong kong bill earnings powell speech 3 thing watch monday,2
hong kongs protest inside polyu siege,2
hong kongs politicized economy,2
hornbach usda release 2018 annual pesticide data program summary hornbach stock marketscreener,2
hot blackfriday tip put thing cart leave,2
green hydrogen could make reality green steel,2
chat chuck schwab inspired bold sp 500 call,2
supreme court case could change city treat homeless via bw,2
technological advance causing boom renewable energy find new infographic power shif,2
beyoncé mariah carey made airbnb luxury brand,2
business lead climate action sponsored tbd medium,2
cheapchic retailer target morphed model avoid retail apocalypse,2
clean hydrogen could make steel industry le dependent coal,2
conservation investment could lifeline endangered specie,2
investor react tesla cybertruck announcement bought gm ford share,2
loan college financialaid package work student need know,2
investor calculate opportunity cost enrico cacciatore ejcacciatore voyainvestments join nasdaq ch,2
one avoid real estate value trap,2
financial advisor strive higher standard recommending life insurance,2
germany universal healthcare system compare united state,2
investing sustainableinfra developing country foster economic climate resilience blog,2
bank gsib score calculated,2
salesforce crm putting tableau mulesoft acquisition work df19,2
many child live poverty state,2
much make salary disclosure could boost earn denitsa_tsekova,2
much garbage generate day read new imfblog see country top list,2
switzerland could find labeled currency manipulator,2
usmca affect u steelmaker auto manufacturer,2
company make meat alternative air,2
adopt smart retirement tax strategy,2
celebrate valentine day budget,2
find cheap buyranked stock trading 10 nasdaq,2
live climatefriendly life,2
make killing biggest housing boom history,2
recover dont stick retirement plan,2
save money 3 holiday 2020,2
trade ulta ulta makeup tutorial needed,2
trader sentiment streaming stock changed since disney launch,2
hr confidential fired revealed office sordid sexanddrugs story via cnbcmakeit,2
huge line hong kong polling station local election month hongkongprotests side urgin,2
human right watch say palmoil producer polluting environment threatening health worker,2
humanity isnt ready next global virus outbreak radio,2
hyperinflation stagnation worse ask latin america,2
hypothecation meaning risk example,2
trend trader stay trend sit sideline clear trend change woulddoes develop,2
cant imagine artwork shadow banned,2
dont blame refusing cook wagyu steak well done fact applaud dont like,2
gave smartphone week lived phone place call hated,2
love fertility clinic decorate even thanks giving ie premature,2
see window fast money trading long side today here plan trading economy stockmarket,2
pleased way navy seal eddie gallaghers trial handled navy treated,2
iberchem group verzeichnet rekordjahr mit übernahme von zwei aromenfirmen und umsatzwachstum von 19,2
hit 237 million powerball jackpot tax bill,2
win 285 million mega million jackpot here first protect windfall,2
household 250000 youre top 5,2
iphone updated latest io option genderneutral emojis,2
youre flush cash here shouldnt live,2
youre worried instead ringing doomsday bell start getting ready,2
il governo etiope e il gruppo alibaba siglano accordi per la creazione di un polo ewtp etiopia,2
illegal tender podcast like befriend convicted socialite scammer anna delvey,2
illicit cannabis supply output still dominates u,2
illinois legalized pot sale debut beat state except one,2
important note performance sean entered contest late didnt start trading almost th,2
world air conditioning intensifying global warming stay cool answer could somethin,2
hong kong protester create visual culture emerges spread vanishes rapidly,2
one corner 32yearold investment firm worth 2218 billion 29yearold pop star worth 360,2
booming economy 90 american say money increase stress level,2
market gaining 128 12 month make top stockfund manager,2
retail apocalypse store like jcp need meet customer convenience,2
income inequality affecting younger generation worker anyone else young people espec,2
income lab idea distribution cut dont panic get update trading finance economy,2
income tax department launch ecalculator compare new old regime,2
increase credit score 1 trick,2
indonesia eye empty island quarantine hub amid virus fear,2
indonesia jokowi warns economic calamity forest fire,2
indonesia jokowi warns economic calamity forest fire,2
innio hansewerk ag pool technological expertise innovative hydrogenfueled combined heat power pl,2
inside canntrust whistleblower reveals new video alleged illegal grow room,2
insider weekend john malone purchase 75 million discovery get update,2
instadollars 10 celebrity earn money instagram,2
instead universal basic income try universal basic stakeholding,2
interactive broker offering fractional share trading broker broadening access e interactivebrokers,2
invest art stock keynes answer well sort,2
investor become richer r 181 lakh crore stock zoom,2
investor get 2 new esg etf 2020,2
investor look emerging market amid trade fight,2
investor often make poor emotional decision based dip portfolio danariely say advic,2
investor penalize company adding woman board,2
ira tax 2020 need know,2
iran join russia china joint naval exercise beginning friday,2
ireland still refuse answer 145 billion tax question,2
cable news keeping average american stock market jimcramer weighs,2
markettiming viable investment strategy follow stock seeking alpha,2
global economy showing sign growth catastrophe sf fed evp director research sylvain leduc shar,2
market pricing guess appropriately,2
plague making comeback actually never went away,2
wuhan new hospital,2
israel third time lucky,2
israeli hurt jerusalem car ramming attack,2
istanbul mull eurobond issue bank balk funding city,2
often pay shop around auto insurance might seem complicated easier think,2
big week u consumer annual retail extravaganza black friday,2
official joker first 1 billion rrated movie,2
tshirt weather antarctica temperature break record,2
italy first country world introduce mandatory climate change lesson school johnfollain,2
good time buy property london say christie,2
year buzzkills legal cannabis industry year biggest offender yes,2
getting harder make money flipping house,2
going tough u white guy america call hunterbiden,2
important mix longterm shortterm investment knowing expect help yo,2
orange man bad dems white man bad american thinker,2
ok take pen office pasta salad,2
okay greg insurance cover,2
rate decision day israel here expect,2
wonderful time year porch pirate sarahhalzack plan stop,2
time 100 tax billionaire estate writes oscar mayer heir,2
ivory coast police clash protester coronavirus test centre economy marketscreener,2
japan find 41 virus case cruise ship,2
japan justice minister say need ban cruise ship due virus fear,2
jeff bezos 160 billion v 953b bill gate 97b v 42b warren buffett 88b v 35b,2
jet industry grand master fight draw dubai stock marketscreener,2
jetblue trying hold onto quirky culture succeeding balancing act airline face keeping,2
jobless american see extra payment soon week,2
job job job,2
john solomon drop 28 uncomfortable fact crushing debunked conspiracy theory narrative,2
john stossel expose climate myth,2
jp morgan bargain stock pick play holiday shopping season completed trade deal,2
jumanji sequel dwayne johnson kevin hart top box office,2
jumia continental drift,2
missed tree lighting doesnt mean cant still come see person holiday season,2
2 people custody authority fired shot intruder vehicle outside trump maralago cl,2
new york city first confirmed case coronavirus borough queen new york daily news r,2
published front page financial time international edition saturday november 23,2
released newest econfocus look fear recession could expectation economy,2
justice seem favor insurer obamacare claim 12b,2
kardashian socialite help saudi seal newcastle united deal,2
karvy case sat asks sebi hear axis bank plea pas order within 15 day,2
key event next week healthcare,2
key supplier negotiation strategy successful procurement request free demo spendedge insight,2
kobe bryant could become better investing say 76ers michael rubin,2
korian sassocie à omedys pour développer le premier réseau de téléconsultation de proximité à léchelle nationale,2
kylie jenner keeping billionaire,2
kylie jenner got even richer,2
la first step housing homeless counting,2
la auto show suv world live suv even car spawning ever suv,2
lachlan murdoch buy mansion record 150m,2
last week community investment council toured greensboro look community better prepare student fo,2
last week hosted 7th imf statistical forum measuring informal economy watch event read,2
latest bridge collapse show italy cant get grip road,2
leader baublebar b8ta leap share theyve learned move digital commerce storefron,2
leaked chinese document show mass surveillance system flag uighur detention camp,2
leave gt failure stay fall get back dust start anew,2
leaving walmart paying several layaway balance thanks child pitching well,2
le dont let get chopped whipsaw,2
let disclose 1 million switzerland go jail 3 year,2
life cruise ship struck coronavirus,2
like premarket post come check u bullshit live breaking news rumor w,2
listen former boeing employee speaks 737 max safety concern story squawk pod,2
listen merger monday bloombergs 2020 presidential run holiday travel congestion story,2
listen holiday week begin 60 billion formally announced involving lvmh charles schwab,2
listen uber revealed disturbing new data sexual assault blowout job report gaming big future wi,2
listen latest regionalview regional economist alex marre discus economic condition conferen,2
listen today yahoo finance daily presented verizonbusiness,2
live ming tsai mingtsai chef restaurant owner join yahoo finance watch,2
living near main road could raise lung cancer risk 10 per cent,2
cool j wife turn cancer battle charitable business,2
london stalling,2
london stock exchange audited result year ending 31 august 2019 londonstockexchange stock,2
london stock exchange pmps hawaii take termite altriset syngenta londonstockexchange,2
london stock exchange public policy social science cross disciplinary divide londonstockexchange stock,2
london underground face bakerloo line strike month,2
london underground face february bakerloo line strike action,2
londong calling property arm world largest auction house christie say buy london rebound,2
look landslide italian village comune pieve di teco left 22 family cut saturday debris dam,2
look antigovernment protester burn tire block road basra demonstration poor service sh,2
look hong kong official count vote city 1st district council election since hongkongprotests bega,2
looking new gig 2020 top 100 best place work 31 tech company top 5 surpr,2
looking lastminute tax loss harvesting idea here one,2
lti utökar strategiskt partnerskap med okq8 scandinavia,2
lucille brobbey black woman able walk office pride wear afro braid withou,2
luke edward hall thoughtful present interior lover,2
macro reviewpreview free weekend bit enjoy time family weekend everyone,2
maduro abraza el capitalismo los emigrantes regresan al pa,2
maduro embrace capitalism venezuelan emigre returning,2
make 125000 2019 here much income tax could pay,2
make retirement topranked mutual fund february 07 2020,2
malaysia plan vaccinate overseas visitor combat polio,2
malaysia return 42 container illegal plastic waste uk,2
many worker dont access retirement saving program effort national state level aim,2
market direction real concern vwap algorithm goal participate volume proportionately th,2
market morning chinese army hong kong boeing walk back comment kraft heinz cheese problem,2
market morning solar breakthrough hong kong bill alibaba win pimco see deal christmas,2
marriotts mission make w hotel cool,2
mary kay pokračuje svém závazku pomáhat ženám na fóru iniciativy global compact osn pro rovnoprávnost pohlaví,2
masayoshi son banker worried favorite client,2
matt miller scouting notebook nfl scout pick top 2020 freeagency signing bleacher report,2
maybe pretty sarge986 take look realmoney stockoftheday ulta,2
measles epidemic sweeping samoa continues worsen death toll rising 25 one,2
medical marijuana investor floodgate open,2
meet eelectricmiguel electric eel powering light christmas tree tnaquarium,2
meet adrenaline first female hero 60year history asterix comic made first appearance,2
meet mgoellos cannabis 50 honoree jim belushi flow kana,2
megalandlord deal germany face mounting investor resistance,2
mercury general insurance urge american take extra precaution secure home netwo mercurygeneral,2
merger arbitrage analysis spread performance april 5 2020 business investing trading,2
merger arbitrage analysis spread performance november 24 2019 read sign update,2
merger arbitrage monday novartis confirms acquisition medicine company get info seeking alpha,2
merriamwebster announced word year search term increased 313 2019,2
mexico remove actual jet presidential jet raffle,2
might one,2
mike piazza explains separate warren buffett investor,2
millennials saving money habit improving,2
millennials seeing health decline faster gen x worrying expert,2
millennials spending money differently generation changing america economy,2
minibond victim confront fca chief andrew bailey,2
missouri american water win third place st louis green business challenge,2
mixed bag volatility would expect,2
mnuchin say monitoring coronavirus spread potential harm u economy,2
mnuchin based current coronavirus info dont expect problem china fulfilling phase one,2
mnuchin u greater clarity coronavirus impact 2 week,2
modern monetary theory unconventional economic theory made popular progressive politician alexandria,2
modi government strangulating kerala denying fund thomas isaac,2
modi government need shed britishstyle bureaucracy move faster say gopichand hinduja,2
moneysupply growth accelerates 28month high get info seeking alpha market finance stock,2
later,2
new york business using state law avoid salt tax cap update economy marketscreener,2
200000 background check gun purchase initiated black friday making secondhighest,2
half generation z already saving home according bank america 2019 fall homebuyer in,2
morgan stanley say forecasting next two month let alone 2020 hard right,2
american think wont need social security theyre wrong,2
msci arm investor esg rating 2800 top firm,2
much electricity used recharge electric vehicle future come natural gas,2
much worse incident fact company thought going protect betrayed,2
music life music everything meâ rapper fatjoe get candid conversation jonfortt sne,2
nj screen 27 passenger curise ship virus risk remains low,2
nasdaq ceo adenatfriedman thrives pressure every time someone taken leap faith said,2
nasdaq ceo company going public need path profitability maxzahn_,2
national grid agreement reached state new york nationalgrid stock marketscreener,2
navarro say he qualified disagree fauci coronavirus medication im social scientist,2
navy say white house wont intervene seal disciplinary hearing,2
navy secretary fired seal controversy,2
navy swap submarine destroyer 2021 budget request shift,2
nba legend magic johnson lebron james favorite win mvp briansozzi,2
nearly half millennials withdraw 401k survey,2
nearly half supply hydroxychloroquine u come maker india banned export al,2
need update week opec meeting tamar essner senior energy director weighed bloombergtv,2
negative interest rate perpetuity paradox follow stock seeking alpha,2
nepal arrested brotherinlaw woman died banished cow shed period,2
network criticized giving trump free airtime cutting back rally dont draw,2
new subscriber stock good company better price morgan stanley say,2
new global electrification platform onestopshop public data modeling tool open source multifun,2
new jersey close public park extends stayathome order death surge,2
new jersey double offshore wind commitment,2
new leak show operating manual reeducation camp chinese muslim xinjiang region,2
new liberty street economics analysis take look bearing burden high tariff chinese good,2
new nyc coffee chain aim undercut starbucks chinainspired model readdanwrite,2
new yahoo finance io app support dark mode user io 13,2
new opcw leak vindicates skeptic establishment syria narrative,2
new product store wont fix pot woe cannabis weekly,2
new research suggests bank think twice shut next bank branch many customer especi,2
new schizophrenia study may usher gamechanging standard care,2
new york city enough n95 mask week still face coronavirus shortage mayor say,2
new york post editorial worse pointless hour televised testimony plainly failed anno,2
new york new virus case fall third straight day,2
new zealand volcano victim identified search continues,2
new old drug may offer fresh way fight heart disease,2
news highlight top company news day newshighlights economy marketscreener,2
news highlight top financial service news day newshighlights economy marketscreener,2
news move 11 dead winter storm 2 hacker found guilty illegal streaming house vote spending deal,2
next week,2
nfl back political crosshairs kaepernick tryout potential trump super bowl ad,2
niger jihadist raid show speed islamic state expansion,2
nih director weighs coronavirus,2
chinese allowed racism fear spreading along coronavirus,2
youre watching episode black mirror mit mini cheetah robot run jump trot backflip,2
nooruddin fidai creating magic moving average moneycontrolcom,2
nord stream 2 past point return,2
north korea threatens resume calling trump dotard,2
whisper smash here road 500 share look elonmusks tesla tsla,2
referred telecom tariff floor price issue trai dot source,2
fast drake,2
onion ivy league student push abolish prison,2
nothing standing repo facility somewhere pozsar screaming,2
notorious rbg talk barmaid accepts berggruen prize,2
november 22 2019 state supreme court sale tax prepare 2020 annual channeladvisor,2
available weekly data asset liability commercial bank united state feddata,2
now time bold,2
nutritional outlook announces winner 2019 best industry award,2
nyc first coronavirus case queen ny daily news,2
nyc health spokesman confirmed suspected coronavirus case,2
nyse say industry review circuitbreakers vertiginous drop ft,2
nyse proposal allow fundraising direct listing rejected sec,2
officer fired body slamming student,2
older worker pushed job problem,2
higher volatility day put tv mute check middle red box tell tha,2
day 1893 trademark cocacola registered united state patent office,2
one billion surveillance camera watching around world 2021 new study say,2
one best hedge fund manager 2019,2
one tariff man aloneeven u presidentcan much,2
one thing sure iowanew hampshire next,2
onetime billionaire say he worth nothing,2
onetime billionaire say he worth nothing,2
onetime billionaire say he worth nothing,2
66 baby boomer think theyll enough money retirement,2
one major cryptocurrency outperformed industry bellwether bitcoin yearand one might exp,2
openview hoping fund size rapid return capital raising,2
opinion past cycle decline unemployment natural rate signal wage pressure,2
opinion explosion volcano new zealand monday raised question whether eruption ca,2
nasdaq employee week set create global impact making meal go hygiene kit,2
70 still working 3 important thing know,2
year since releasing first augmented reality headset developer magic leap wooing company,2
pablo escobars brother selling foldable phone,2
patient engagement solution market reach usd 3036 billion 2026 report data,2
paul volckers message next generation,2
paul wolfowitzs nyt oped blatherings sanctimonious sicko,2
paulson drop opposition calloncarrizo merger,2
paving way last hurrah read sign update economy investing stockmarket,2
paying debt versus investing money common problem u household here handle,2
payment highvalue deal bribe mahathir say airasia probe,2
payment highvalue deal bribe say mahathir asked airasia probe,2
penny dismisses idea u buying nokia ericsson challenge huawei,2
penn station stink neighborhood looking,2
pensacola navy base shooter identified saudi national,2
pensacola shooting suspect saudi national u flight training abc,2
pentagon asks navy secretary richard spencer resign controversy navy seal case,2
pentagon chief asks navy secretary richard spencer resign controversy navy seal case,2
pentagon chief fire navy secretary seal controversy,2
pentagon issue guidance troop abroad coronavirus outbreak spread,2
people trying store essential potato sold r 80 kilogram guwahati,2
philippine nickel miner chinese battery maker exploring potential collaboration ahead indonesia ba,2
pioneer value investing trying see dead,2
plane packed holiday season grounding boeings 737 max continues,2
plan new global football competition branded insane,2
platts 5 commodity chart watch week,2
politics market 112519 read business market economy,2
pope francis demanded world leader renounce atomic weapon cold warera doctrine deterrence,2
pope francis isnt infallible economics,2
porch pirate swipe package third holiday shopper denitsa_tsekova,2
power ranking retail roller coaster crypto crash course mock milk top moment week,2
predata amazing thing,2
preferred stock offer investor alternative bond investinyou partnership acorn,2
prepare day ahead wsb,2
presentando una revolución en blanqueamineto dental la pasta dental colgate optic white renewal,2
presenteeism practice work really due feeling unwell distracted among,2
priceless jewelry artifact stolen german museum,2
priest tell christian practice social distancing easter approach,2
prince get 2 trillion aramco victory come cost,2
private equity bottom line benefit gender diversity,2
priya ramanis allegation sexual misconduct figment imagination mj akbar tell court,2
priyanka chopra jonas crocs donarán 50 000 pares de calzado clásico unicef,2
prohibition ended today 86 year ago,2
property portfolio finding safety uk six biggest city,2
putin order payment wwii veteran russia baltic,2
q virus affect fed outlook goldman slightly increase downside risk call,2
q significance nasdaq market maker jay heller nasdaq vp head capital market explai,2
qatar 320 billion wealth fund seek catch technology,2
quarantined hong kong ship passenger turn mahjong buffet,2
quarterly service report,2
queen cancel prince andrew 60th birthday besties dead pedophile,2
quicktake malawi historic ruling,2
rabobank key reason mess due volcker,2
racing ice,2
raid egypt last independent news website cause chill,2
rating sagging,2
ray dalio fire back hedge fund reported 15b bet via foxbusiness,2
ray dalio mentoring sean comb,2
ray dalio isnt disputing investment wsj reported definitely taking issue wsj headl,2
rbi put bank alert say governor shaktikanta da,2
read instant analysis federal reserve interest rate decision chairman powell press conferen,2
real christmas tree may cost 12x national monthly minimum wage venezuelan buying drove,2
recap week market activity,2
recession see dont daily maverick,2
recommending life insurance doesnt complicated conflict interest here financial advisor,2
record pe deal number 2019 fail hide global deal value drop,2
recordjaar voor de iberchemgroep met voltooiing van de overname van twee smaakstoffenfabrikanten en 19 omzetgroei,2
