text,label
bynd jpmorgan reel expectation beyond meat,0
ccl rcl nomura point booking weakness carnival royal caribbean,0
cx cemex cut credit suisse jp morgan weak building outlook,0
es btig research cut neutral,0
fnko funko slide piper jaffray pt cut,0
fti technipfmc downgraded berenberg called top pick deutsche bank,0
gm gm loses bull,0
gm deutsche bank cut hold,0
gtt cowen cut market perform,0
hnhaf hnhpd aapl trendforce cut iphone estimate foxconn delay,0
hog moody warns harleydavidson,0
hxl citing aero tie well slash pt hexcel,0
intelsat cut market perform raymond james,0
krg compass point cut sell,0
lk muddy water go short luckin coffee,0
mant mantech downgraded ahead difficult comp,0
mdco oppenheimer cut perform,0
mplx mpc mplx cut credit suisse potential dilution marathon strategic review,0
msgn imperial downgrade msg network amid sportsfree airwave,0
mtls piper hit materialise sideline,0
ncbs hovde group cut market perform,0
nflx new netflix bear step,0
shop shopify loses bull,0
stay nomura instinet loses confidence extended stay america,0
twlo twilio get streetlow target virus risk,0
vclt splb iglb guggenheim minerd see gloom ahead stock,0
viac viaca fox moffettnathanson expects nfl tv cost skyrocket,0
viac barrington research cut mkt perform,0
xlnx mizuho cut xlnx target nearterm headwind,0
2u downgraded sector weight overweight keybanc capital,0
alphabet facebook price target cut barclays weaker ad outlook,0
amc network price target cut 35 39 imperial capital,0
american software downgraded neutral buy b riley fbr,0
analyst question silicon motion margin outlook,0
anchiano therapeutic downgraded peer perform outperform oppenheimer,0
arch coal stock price target cut 97 100 b riley fbr,0
att downgraded moffettnathanson sell concern wireless cant carry whole company,0
att share sink moffettnathanson downgrade,0
att stock fall moffettnathanson downgrade saying dividend look le compelling,0
aurora cannabis stock price target cut c100 c175 stifel nicolaus,0
autodesk downgraded underweight neutral jpmorgan,0
baml warns profit pressure hormel,0
barclays cool molson coors,0
becton dickinson downgraded outperform strong buy raymond james,0
becton dickinson downgraded sector weight overweight keybanc capital,0
berry petroleum downgraded market perform outperform bmo capital,0
berry petroleum downgraded underweight sector weight keybanc capital,0
bluebird bio downgraded line outperform evercore isi,0
bluebird bio stock price target cut 86 172 evercore isi,0
canada goose downgraded buy strong buy cfra,0
canada goose stock price target cut 50 65 cfra,0
childrens place downgraded ecommerce put margin risk,0
childrens place price target cut 80 105 monness crespi hardt,0
cinedigm corp analyst cutting estimate here need know,0
clovis oncology stock price target cut 8 12 evercore isi,0
cumberland pharmaceutical stock price target cut 900 1225 b riley fbr,0
dell hpe target trimmed compute headwind,0
dish may key winner amid intelsat woe analyst,0
disney downgraded analyst say park attendance could take 2 year normalize,0
downgrade 1125 aeo colm dgii eqt es evrg gtt krg mant mdco nflx omp peg pru sbt sitc tap vip,0
downgrade 47 mlnd msgn mtls oc ovv peb pk plya qep rhp rpai saia sdc shop sky slg sm twlo,0
dropbox watch stinging spruce point report,0
earnings update electrocore inc reported analyst trimming forecast,0
evercore downgrade bluebird bio clovis premarket analyst action,0
fannie mae freddie mac downgraded sell analyst cite unintended consequence care act,0
forescout downgraded neutral buy monness crespi hardt,0
formfactor cut unsustainable revenue outlook,0
funko downgraded hold buy stifel nicolaus,0
funko stock price target cut 10 25 stifel nicolaus,0
gm stock price target cut 30 32 deutsche bank,0
grubhub gain bear margin view,0
hp downgraded argus drilling industry weakness seen persisting,0
hanesbrands stock price target cut 13 v 16 bofa merrill lynch,0
helmerich payne started sell 34 stock price target deutsche bank,0
hexo stock price target cut c5 c6 mkm partner,0
home depot stock price target cut 237 240 instinet,0
intelsat downgraded underweight neutral jp morgan,0
intelsat lower morgan stanley target cut,0
jefferies warns l brand,0
kohl stock price target cut 48 52 deutsche bank,0
kohl stock price target cut 50 53 wedbush,0
l brand stock price target cut 16 20 wedbush,0
lovesac stock price target cut 28 v 33 canaccord,0
lyft stock price target cut 58 70 deutsche bank,0
macerich downgraded underweight sector weight keybanc capital,0
marinus pharma stock price target cut 6 7 leerink,0
methanex downgraded td security valuation,0
metro inc missed earnings eps looked sad analyst updated model,0
midamerica apartment community downgraded sector weight overweight keybanc capital,0
mitek system stock price target cut 11 14 benchmark,0
napco security stock price target cut 30 35 imperial capital,0
needhams martin defends prediction netflix subscription fall,0
netflix downgraded underperform needham,0
netflix stock fall well fargo turn bearish,0
new netflix bear step,0
new york opioid case significant risk pharma stock say bearish bofa,0
norwegian cruise line downgraded strong sell hold cfra,0
novo nordisk downgraded ubs concern drug launch cost,0
oppenheimer cut estimate yum china,0
orbcomm price target lowered 9 canaccord,0
oreilly automotive stock price target cut 405 415 jp morgan,0
pattersonuti energy started sell 7 stock price target deutsche bank,0
p business park downgraded underweight sector weight keybanc capital,0
rio tinto downgraded neutral overweight jp morgan,0
rosenblatt project 47 downside apple share warns drop iphone production,0
royal caribbean downgraded sell buy cfra,0
royal caribbean stock price target cut 100 135 cfra,0
royal caribbean stock fall cfra swing bearish dire coronavirus assessment,0
scandinavian tobacco group earnings missed analyst estimate here analyst forecasting,0
sherwinwilliams cut conviction buy goldman valuation,0
sirius downgraded valuation,0
spotify double downgrade reflects prospect slower revenue growth,0
suntrust latest trim nielsen target,0
taco bell parent yum brand downgraded neutral buy btig,0
taketwo downgraded murky game slate,0
taketwo interactive stock price target cut 124 133 mkm partner,0
target hospitality downgraded perform outperform oppenheimer,0
taubman center downgraded sector weight overweight keybanc capital,0
manitowoc company inc reported earnings analyst cut target price,0
transocean started sell 3 stock price target deutsche bank,0
ultra clean downgraded hold buy stifel nicolaus,0
well fargo downgrade netflix nflx underperform see takeover target nflx could get acquired nflx,0
well fargo downgrade netflix spending concern,0
well fargo downgrade netflix content king cash queen,0
welltower stock price target cut 90 95 jp morgan,0
wwe stock price target cut 57 79 benchmark,0
altg dougherty company start buy,1
amd amd navi show strong adoption bofa,1
ancuf bmo capital market ups outperform,1
bhe lake street start buy,1
cnc sp raise centene corp rtg bbb bb outlk stable,1
de citi give big boost deere pt,1
ebay guggenheim see favorable catalyst ebay,1
fcx freeport upgraded credit suisse see big buying opportunity,1
flxn btig research start buy,1
fnv franconevada need funding despite suspension analyst say,1
gbt cantor fitzgerald resume overweight,1
gm morgan stanley see gm doubling bull case scenario,1
goo barclays start overweight,1
hasbro gain ubs upgrade,1
jd new bull praise acceleration margin profile,1
jd barclays ups overweight,1
khc jpmorgan constructive kraft heinz,1
kim compass point ups neutral,1
low lowes rack another positive rating despite recession risk,1
lrcx lam target boosted compelling setup,1
lulu barclays start overweight,1
mu wdc bull see 2020 upside mu wdc,1
nby rated buy,1
nflx suntrust expecting netflix post strong user growth,1
nvda nvidia set gaming tailwind bofa,1
ocn btig see material improvement ocwen book value,1
oyst cowen start outperform,1
rapt bmo capital market start outperform,1
rng evercore start ringcentral outperform,1
sbac sbac amt moffettnathanson boost sbac buy,1
snap loop turn bullish snap ad growth,1
stxs lake street start buy,1
tenb cowen see upside tenbs indegy purchase,1
uber lyft uber lyft raise price profit barclays,1
wabc maxim group ups buy,1
wri compass point ups buy,1
z new zscaler bull see sustainable growth share 4,1
activision taketwo chart look constructive well fargo get bullish video game play trader atvi ttwo,1
adobe stock price target raised 315 v 290 wedbush,1
adobe stock price target raised 318 v 310 instinet,1
aegis capital positive netflix usage trend,1
60 drop 6 month bank america say buy pot stock canopy,1
akero therapeutic started buy 36 stock price target canaccord genuity,1
align technology stock price target raised 305 290 stifel nicolaus,1
allergan upgraded buy neutral ubs,1
altria stock price target raised 54 50 stifel nicolaus,1
amneal pharma price target raised 6 v 4 suntrust robinson humphrey,1
analyst loop capital upgrade lyft buy hold citing higher revenue growth potential,1
analyst att top telecom pick 2020,1
analyst mostly bullish newly public insurance firm brp group,1
analyst see 18 gain ahead holding first trust dow jones internet index fund etf,1
ansys stock price target raised 265 235 benchmark,1
anthem stock price target raised 330 300 suntrust rh,1
applied industrial technology stock price target raised 70 65 keybanc capital,1
argenx stock price target raised 255 v 203 instinet,1
armata pharmaceutical started buy 8 stock price target maxim group,1
arrow electronics stock price target raised 87 v 84 suntrust robinson humphrey,1
asset management one co bullish call treasury one long long run,1
audentes therapeutic stock price target raised 40 34 evercore isi,1
audentes therapeutic upgraded outperform line evercore isi,1
axcelis technology stock price target raised 32 24 benchmark,1
baird bullish beatup canada goose,1
baird like drug wholesaler premarket analyst action,1
baird return wingstop bull camp,1
baker hughes started buy 32 stock price target deutsche bank,1
bank america stock price target raised 49 48 oppenheimer,1
barclays analyst say uber lyft wellpositioned achieve profitability,1
bausch health upgraded overweight neutral jpmorgan price target raised 38 32,1
bed bath beyond reiterated buy bofa merrill lynch,1
belden stock price target raised 56 v 54 suntrust robinson humphrey,1
benchmark say roof supplier buy,1
bernstein turn bullish vmwares valuation,1
berry petroleum upgraded sector weight underweight keybanc capital,1
best buy stock price target raised 105 86 oppenheimer,1
biogen stock price target raised 392 320 instinet,1
biogen stock price target raised 410 350 svb leerink,1
boeing stock price target raised 427 406 cfra,1
bofa upgrade westrock containerboard conference london pulp week,1
bouygues sa beat analyst forecast analyst updating prediction,1
btig expects domino boost buyback,1
btig see material improvement ocwen book value,1
bull see 2020 upside mu wdc,1
cabot upgraded buy neutral ubs,1
canada goose upgraded outperform neutral baird price target c53,1
capital southwest initiated outperform raymond james 2350 price target,1
celanese stock price target raised 120 v 111 bofa merrill lynch,1
cf industry stock price target raised 56 v 52 bofa merrill lynch,1
cf industry upgraded buy v neutral bofa merrill lynch,1
ciena stock price target raised 47 v 43 instinet,1
citi give big boost deere pt,1
citi reel pt nu skin,1
citron say long luckin coffee mw v citron,1
cnh industrial upped buy deutsche bank valuation,1
copa holding stock price target raised 130 103 deutsche bank,1
costco price target raised 330 v 320 bofa merrill lynch,1
csx stock price target raised 90 72 deutsche bank,1
csx upgraded buy hold deutsche bank,1
cv health stock price target raised 90 85 suntrust rh,1
cyrusone upgraded overweight sector weight keybanc capital,1
diamondrock hospitality upgraded sector weight underweight keybanc capital,1
dlh holding maintained buy 7 price target canaccord,1
domtar upgraded market perform bmo capital,1
dow stock price target raised 52 v 46 bofa merrill lynch,1
earnings update here analyst lifted aemetis inc price target us225,1
earnings update here analyst lifted milestone scientific inc price target us200,1
earnings update here analyst lifted skyworks solution inc price target us104,1
eastman chemical stock price target raised 85 v 82 bofa merrill lynch,1
edgewell stock price target raised 41 33 cfra,1
elastic upgraded buy hold canaccord genuity,1
enbridge upgraded buy neutral ubs price target lifted c54 c50,1
energizer holding upgraded neutral underweight jp morgan price target lifted 51 41,1
energizer shake jpmorgans bear call,1
equity lifestyle property upgraded outperform bmo capital,1
estee lauder stock price target raised 238 202 raymond james,1
etsy initiated buy 55 price target suntrust robinson humphrey,1
fedex stock price target raised 168 163 bofa security,1
fleetcor stock price target raised 325 310 cfra,1
ford electric suv impress credit suisse,1
fortinet stock price target raised 115 104 bmo capital,1
fortinet stock price target raised 120 110 monness crespi hardt,1
glenmark pharmaceutical limited beat analyst forecast analyst updating prediction,1
goldman add workday conviction list share 1,1
goldman say 36000 rally brazilian retailer room run,1
grubhub stock price target raised 40 34 oppenheimer,1
grubhub stock price target raised 60 30 susquehanna,1
hasbro upgraded earnings growth potential entertainment one acquisition,1
hasbro upgraded buy neutral ubs price target 117,1
heat biologics started buy 1 stock price target maxim group,1
home depot upgraded outperform neutral credit suisse price target raised 235 225,1
humana stock price target raised 363 319 deutsche bank,1
huntsman named conviction buy goldman chemical sector shuffle,1
intel stock price target raised 62 v 60 suntrust robinson humphrey,1
intercept pharmaceutical maintained buy 165 price target canaccord,1
invitae corp maintained buy benchmark,1
jc penney stock price target raised 100 80 cent b riley fbr,1
jabil stock price target raised 47 36 cfra,1
jefferies analyst lifted tesla tsla share buy paring price target 19,1
jpmorgan like bausch health premarket analyst action,1
jpmorgan bullish ubers upside potential,1
kilroy realty upgraded overweight sector weight keybanc capital,1
l3harris started buy 280 stock price target benchmark,1
lagging mlp upgraded goldman new project seen lifting cash flow,1
ligand pharmaceutical started buy 135 stock price target benchmark,1
lovesac maintained buy canaccord,1
lululemon stock price target raised 260 v 222 susquehanna,1
lyft stock get upgrade due competitive positioning,1
lyondellbasell sock price target raised 107 v 99 bofa merrill lynch,1
magnolia oil gas started overweight 14 stock price target keybanc capital,1
mesa air reiterated outperform cowen,1
microchip technology stock price target raised 113 v 106 suntrust robinson humphrey,1
mizuho raise intel aggressive price cut,1
molina healthcare stock price target raised 165 155 suntrust rh,1
morgan stanley analyst joseph moore upgraded nvidia nasdaq nvda equalweight overweight price tar,1
morgan stanley bullish eldorado resort ahead caesar combination,1
morgan stanley join mortgage sector bull,1
morgan stanley raise fortinets price target bullish analyst day,1
morgan stanley upgrade nvidia nvda equalweight overweight announces 259 price target,1
morgan stanley upgrade nvidia buy predicting 2020 return solid growth,1
munster double say apple 40 upside year,1
new bull see 22 upside splunk,1
new subscriber morgan stanley add amazon list favorite stock rest,1
newmont goldcorp stock price target raised 4150 3950 b riley fbr,1
nlight target raised nutronics deal,1
nokia stock price target raised 600 550 mkm partner,1
nuvasive upgraded outperform v market perform leerink,1
nvidia one best opportunity maintain high multiple morgan stanley say upgrade,1
nvidia stock climb morgan stanley turn bullish,1
nxp semiconductor stock price target raised 139 v 128 suntrust robinson humphrey,1
olin corp stock price target raised 23 v 22 bofa merrill lynch,1
one analyst say td could unlock significant value selling minority stake ameritrade purchase,1
onto innovation stock price target raised 50 40 benchmark,1
owen corning upgraded well raising residential insulation price,1
owen corning upgraded strong insulation roofing potential,1
oyster point pharma initiated overweight 26 price target jp morgan,1
paul tudor jones see potential stock market explosion upside,1
pennmac financial rise record piper get bullish,1
piper like dexcom premarket analyst action,1
pixelworks inc reported analyst lifting price target,1
ppg industry stock price target raised 113 v 105 bofa merrill lynch,1
prothena upgraded outperform line evercore isi,1
purple innovation initiated overweight 12 price target keybanc capital,1
quanterix maintained outperform 35 price target leerink,1
result kla corporation beat earnings expectation analyst new forecast,1
rpm international stock price target raised 79 v 75 bofa merrill lynch,1
sp global stock price target raised 322 274 stifel nicolaus,1
sanderson farm stock price target raised 159 150 jp morgan,1
schlumberger started buy 42 stock price target deutsche bank,1
selvaag bolig asa beat earnings expectation here analyst think happen next,1
softbank last laugh wework deal one bernstein analyst say,1
sonoma pharma maintained buy 9 price target benchmark,1
splunk upgraded overweight morgan stanley,1
starbucks stock buy according investment bank,1
starbucks upgraded overweight jp morgan meeting executive,1
stifel upgrade parkerhannifin potential synergy industry recovery prospect,1
stifel upgrade wendys bullish breakfast digital prospect,1
syanptics raised forecast margin strength,1
synaptics stock price target raised 40 32 jp morgan,1
synopsys upgraded overweight neutral jpmorgan price target raised 160 157,1
te connectivity stock price target raised 95 v 94 suntrust robinson humphrey,1
teekay tanker upped two notch buy baml,1
texas instrument stock price target raised 125 v 122 suntrust robinson humphrey,1
twitter stock price target raised 3650 3450 wedbush,1
twitter stock price target raised 38 36 suntrust rh,1
twitter stock price target raised 47 34 susquehanna,1
twitter inc reported analyst lifting price target,1
u well service initiated buy 350 price target stifel,1
uber stock price target raised 45 34 mkm partner,1
uber stock price target raised 49 47 bofa security,1
uber stock price target raised 50 45 oppenheimer,1
uber stock price target raised 52 50 wedbush,1
uber stock price target raised 54 50 deutsche bank,1
ubs raise pelotons price target 40,1
ubs upgrade hasbro strong sale frozen ii doll black friday,1
udr upgraded overweight sector weight keybanc capital,1
unisys stock price target raised 21 18 sidoti co,1
unitedhealth stock price target raised 338 303 cfra,1
upgrade 1125 arwr caci cf deck dks enr eqm etrn fe hlx jd kim lyft ntr nvda oran pro snap wen wing wri z,1
upgrade 47 amt bhp bk chh eni eqnr etr exr fcx holx hsic low lsi mar ma mgp mhk mxl ngg nwe,1
vertex pharmaceutical stock price target raised 248 240 bmo capital,1
vertical research expects allison transmission break,1
voyager therapeutic started outperform 26 stock price target oppenheimer,1
walt disney stock price target raised 143 141 imperial capital,1
well fargo analyst dori kesten lifted rating marriott mar overweight noting hotel chain sha,1
well still bullish tmobile unsurprising ceo change,1
westlake chemical stock price target raised 65 v 64 bofa merrill lynch,1
westrock stock price target raised 48 42 bofa merrill lynch,1
westrock upgraded buy neutral bofa merrill lynch,1
credit suisse see sp 500 gaining 10 2020,1
williams co initiated buy 27 price target suntrust robinson humphrey,1
workday added goldman conviction list stock gain,1
zendesk stock price target raised 85 75 stifel nicolaus,1
zendesk target raised solid result,1
lb mkm partner put number victoria secret,2
wing baird return wingstop bull camp,2
analyst react fcc decision intelsat cband spectrum auction,2
arex capital ramp pressure zagg,2
aviation capital group assigned baa2 rating moody,2
benzingas top upgrade downgrade december 17 2019,2
benzingas top upgrade downgrade november 25 2019,2
brp group started hold 18 stock price target jefferies,2
btig resume coverage range healthcare stock neutral abbvie,2
bull camp empty sally beauty,2
ca1060 thats analyst think vecima network inc worth result,2
chicken soup soul entertainment inc thirdquarter result here analyst forecasting next year,2
citron research owned prominent short seller andrew left placed 5 price target pton,2
coin toss morgan stanley raise tesla bull case 500 keep bear case 10,2
gd holding limited released thirdquarter earnings here analyst think,2
global automotive tensioner market 20192023 growing adoption startstop system boost growth technavio,2
biggest analyst call day johnson johnson canopy growth intelsat,2
biggest analyst call day netflix nvidia lyft molson coors snap,2
biggest analyst call day netflix nvidia lyft molson coors snap,2
iivi inc initiated neutral susquehanna,2
liveperson started neutral 40 stock price target jp morgan,2
miller value partner like two stock bearish one,2
mkm partner put number victoria secret,2
morgan stanley new favorite pick chip space,2
mplx initiated hold 28 price target suntrust robinson humphrey,2
oppenheimer call transformation bigbox retailer,2
pipestone energy corp reported analyst assigned ca255 price target,2
royal caribbean cruise ltd fullyear result came here analyst forecasting next year,2
spirit airline inc released fullyear result analyst updating estimate,2
stock market update nvidia share upgraded netflix downgraded,2
tjx q3 factset consensus 66 cent,2
top analyst upgrade downgrade abbvie biogen boeing etsy gilead gopro micron newmont peloton pfizer valero zynga,2
twilio inc fullyear result came here analyst forecasting next year,2
upgrade 24 amal cm cmcsa elf gdot lfus mli rrr td txrh vly ww downgrade 24 abg awk chkp deo,2
us5008 thats analyst think weibo corporation worth latest result,2
valaris started hold 4 stock price target deutsche bank,2
william blair see rival pressing viasat,2
aggressive fed boost fails stop selloff sampp500 economy marketscreener,0
bank ireland cut key profit target low rate take toll,0
bank nova scotia scotiabank ceo expects somewhat elevated loan loss 34 quart bankofnovascotia,0
breakingviews fed ultraloose effort cast long shadow,0
european bank slash 280bn main u business,0
europe bank halfway cleaning 1 trillion loan turned sour last cr,0
eurozone bank return already hurting covid19 ecb say,0
fed liquidity drain spoil virussurgeinspired stock buyingpanic zero hedge,0
fed policymakers working limit damage pandemic put u economy pause,0
fed report smallbusiness sector highly vulnerable coronavirus crisisupdate fedreport economy,0
fed warns virus pose new risk global growth market,0
fed bullard china slow noticeably first quarter due virus,0
fed corporate credit measure limit buyback dividend,0
fed williams risk u economy still downside,0
former fed chief bernanke see bad year quick recovery economy marketscreener,0
janet yellen say vshaped economic recovery possible worried outcome worse,0
lagarde say ecb running room fight global threat,0
lagarde say ecbs option limited low rate low inflation,0
new imfblog show longlasting credit boom featured rapid construction growth never ended well,0
overall fed temporary liquidity continues shrink economy marketscreener,0
schweizerische nationalbank switzerland loses grip world lowest borrowing cost,0
official worried bank decision drop selfimposed limit ecbs bond purchase,0
thailand limited space deliver strong dose monetary policy central bank governor say cautio,0
federal reserve rescue overnight lending market appears unintended side effect j,0
uae stimulus help bank liquidity may increase problem loan moody economy marketscreener,0
update 2china cbank warns high financial risk amid rising economic headwind,0
yellen blame enormous debt buyback coming default wave morgan stanley say fed fault,0
fed chair powell reason rising wage job gain cant continue,1
federal reserve chairman jerome powell said u economy resilient even cited potential threat,1
fed bazooka soothes dollar funding squeeze,1
fed daly say u economy well placed weather storm,1
fed daly say u job market still room run,1
fed kaplan inflation muted time radio,1
fed mary daly say current interest rate put economy good place weather storm,1
fed mester upbeat outlook say central bank watch wait interest rate,1
fed rosengren say optimistic economy,1
fed rosengren say u unlikely economic downturn 2020,1
world bank malpass upbeat prospect progress debt relief economy marketscreener,1
commercial industrial loan commercial bank fall 2345 trillion 7 billion week earlie,2
czech interest rate could stay another year global risk cloud outlook exportor,2
ecb bought record debt volume last week crisis fight economy marketscreener,2
fed chairman jerome powell say central bank watching carefully firm brace wave missed mortgage paymen,2
italy top bank unveils new lending measure firm battle cash crunch,2
fed may lower rate support facility money market fund strategist say,2
econx federal reserve establish facility facilitate lending small business via small business,2
xlf fa faz fed revives talf bolster ab market,2
xlf fa faz fed establish term financing small business loan,2
worldbank group asks g20 leader suspend debt repayment poorest country help focus critica,2
asset allocation committee outlook 2q2020 contagion economy market investing,2
australia central bank pump liquidity proposes bond buy ease financial condition,2
australia plan additional a66 billion 382 billion stimulus coronavirusstricken economy includ,2
bank israel expands crisis qe 136 billion bond buying,2
